{
  "schema_version": 1,
  "programming_language": "ts",
  "ui_language": "ko",
  "lessons": {
    "ts-output": {
      "title": "출력",
      "concept": "console.log로 한 줄을 출력합니다. TypeScript에서 출력을 익힐 때는 예제의 어느 줄이 값을 만들고 어느 줄이 그 값을 출력으로 연결하는지 표시해 보세요. 시작 코드를 고치기 전에는 현재 코드가 무엇을 출력할지 먼저 적어야 합니다.",
      "worked_example": "이 풀이 예제는 TypeScript의 출력 규칙이 실제 코드에서 어디에 놓이는지 보여줍니다. 값이 준비되는 줄, 그 값을 읽는 표현식, 출력으로 이어지는 줄을 분리해서 읽어 보세요.",
      "common_mistakes": [
        "출력의 역할을 보지 않고 예제 모양만 복사하는 것",
        "TypeScript 시작 코드의 현재 출력을 확인하지 않고 바로 수정하는 것",
        "이번 단원이 연습하는 규칙보다 괄호나 철자만 먼저 고치는 것"
      ],
      "self_check": [
        "예제에서 출력될 값을 만드는 표현식은 어디인가요?",
        "그 값이 비어 있거나 타입이 다르면 어떤 결과가 나올까요?",
        "시작 코드에서 출력 규칙과 직접 연결된 한 줄은 무엇인가요?"
      ],
      "exercise_prompt": "TypeScript의 출력 실습을 완성하세요. 시작 코드의 현재 출력을 먼저 예측한 뒤, 이 단원의 규칙과 연결된 부분만 수정하세요. 기대 출력을 상수로 붙여 넣지 마세요."
    },
    "ts-variables": {
      "title": "변수",
      "concept": "let은 재할당할 수 있고 const는 다시 대입할 수 없습니다. TypeScript에서 변수을 익힐 때는 예제의 어느 줄이 값을 만들고 어느 줄이 그 값을 출력으로 연결하는지 표시해 보세요. 시작 코드를 고치기 전에는 현재 코드가 무엇을 출력할지 먼저 적어야 합니다.",
      "worked_example": "이 풀이 예제는 TypeScript의 변수 규칙이 실제 코드에서 어디에 놓이는지 보여줍니다. 값이 준비되는 줄, 그 값을 읽는 표현식, 출력으로 이어지는 줄을 분리해서 읽어 보세요.",
      "common_mistakes": [
        "변수의 역할을 보지 않고 예제 모양만 복사하는 것",
        "TypeScript 시작 코드의 현재 출력을 확인하지 않고 바로 수정하는 것",
        "이번 단원이 연습하는 규칙보다 괄호나 철자만 먼저 고치는 것"
      ],
      "self_check": [
        "예제에서 출력될 값을 만드는 표현식은 어디인가요?",
        "그 값이 비어 있거나 타입이 다르면 어떤 결과가 나올까요?",
        "시작 코드에서 변수 규칙과 직접 연결된 한 줄은 무엇인가요?"
      ],
      "exercise_prompt": "TypeScript의 변수 실습을 완성하세요. 시작 코드의 현재 출력을 먼저 예측한 뒤, 이 단원의 규칙과 연결된 부분만 수정하세요. 기대 출력을 상수로 붙여 넣지 마세요."
    },
    "ts-strings": {
      "title": "문자열",
      "concept": "문자열은 length와 반복을 제공합니다. TypeScript에서 문자열을 익힐 때는 예제의 어느 줄이 값을 만들고 어느 줄이 그 값을 출력으로 연결하는지 표시해 보세요. 시작 코드를 고치기 전에는 현재 코드가 무엇을 출력할지 먼저 적어야 합니다.",
      "worked_example": "이 풀이 예제는 TypeScript의 문자열 규칙이 실제 코드에서 어디에 놓이는지 보여줍니다. 값이 준비되는 줄, 그 값을 읽는 표현식, 출력으로 이어지는 줄을 분리해서 읽어 보세요.",
      "common_mistakes": [
        "문자열의 역할을 보지 않고 예제 모양만 복사하는 것",
        "TypeScript 시작 코드의 현재 출력을 확인하지 않고 바로 수정하는 것",
        "이번 단원이 연습하는 규칙보다 괄호나 철자만 먼저 고치는 것"
      ],
      "self_check": [
        "예제에서 출력될 값을 만드는 표현식은 어디인가요?",
        "그 값이 비어 있거나 타입이 다르면 어떤 결과가 나올까요?",
        "시작 코드에서 문자열 규칙과 직접 연결된 한 줄은 무엇인가요?"
      ],
      "exercise_prompt": "TypeScript의 문자열 실습을 완성하세요. 시작 코드의 현재 출력을 먼저 예측한 뒤, 이 단원의 규칙과 연결된 부분만 수정하세요. 기대 출력을 상수로 붙여 넣지 마세요."
    },
    "ts-control-flow": {
      "title": "제어 흐름",
      "concept": "if와 반복문으로 실행 흐름을 제어합니다. TypeScript에서 제어 흐름을 익힐 때는 예제의 어느 줄이 값을 만들고 어느 줄이 그 값을 출력으로 연결하는지 표시해 보세요. 시작 코드를 고치기 전에는 현재 코드가 무엇을 출력할지 먼저 적어야 합니다.",
      "worked_example": "이 풀이 예제는 TypeScript의 제어 흐름 규칙이 실제 코드에서 어디에 놓이는지 보여줍니다. 값이 준비되는 줄, 그 값을 읽는 표현식, 출력으로 이어지는 줄을 분리해서 읽어 보세요.",
      "common_mistakes": [
        "제어 흐름의 역할을 보지 않고 예제 모양만 복사하는 것",
        "TypeScript 시작 코드의 현재 출력을 확인하지 않고 바로 수정하는 것",
        "이번 단원이 연습하는 규칙보다 괄호나 철자만 먼저 고치는 것"
      ],
      "self_check": [
        "예제에서 출력될 값을 만드는 표현식은 어디인가요?",
        "그 값이 비어 있거나 타입이 다르면 어떤 결과가 나올까요?",
        "시작 코드에서 제어 흐름 규칙과 직접 연결된 한 줄은 무엇인가요?"
      ],
      "exercise_prompt": "TypeScript의 제어 흐름 실습을 완성하세요. 시작 코드의 현재 출력을 먼저 예측한 뒤, 이 단원의 규칙과 연결된 부분만 수정하세요. 기대 출력을 상수로 붙여 넣지 마세요."
    },
    "ts-functions": {
      "title": "함수",
      "concept": "매개변수와 반환 타입을 적어 의도를 명확히 합니다. TypeScript에서 함수을 익힐 때는 예제의 어느 줄이 값을 만들고 어느 줄이 그 값을 출력으로 연결하는지 표시해 보세요. 시작 코드를 고치기 전에는 현재 코드가 무엇을 출력할지 먼저 적어야 합니다.",
      "worked_example": "이 풀이 예제는 TypeScript의 함수 규칙이 실제 코드에서 어디에 놓이는지 보여줍니다. 값이 준비되는 줄, 그 값을 읽는 표현식, 출력으로 이어지는 줄을 분리해서 읽어 보세요.",
      "common_mistakes": [
        "함수의 역할을 보지 않고 예제 모양만 복사하는 것",
        "TypeScript 시작 코드의 현재 출력을 확인하지 않고 바로 수정하는 것",
        "이번 단원이 연습하는 규칙보다 괄호나 철자만 먼저 고치는 것"
      ],
      "self_check": [
        "예제에서 출력될 값을 만드는 표현식은 어디인가요?",
        "그 값이 비어 있거나 타입이 다르면 어떤 결과가 나올까요?",
        "시작 코드에서 함수 규칙과 직접 연결된 한 줄은 무엇인가요?"
      ],
      "exercise_prompt": "TypeScript의 함수 실습을 완성하세요. 시작 코드의 현재 출력을 먼저 예측한 뒤, 이 단원의 규칙과 연결된 부분만 수정하세요. 기대 출력을 상수로 붙여 넣지 마세요."
    },
    "ts-input": {
      "title": "입력 파싱",
      "concept": "Node 환경에서는 stdin을 읽어 작은 예제를 풀 수 있습니다. TypeScript에서 입력 파싱을 익힐 때는 예제의 어느 줄이 값을 만들고 어느 줄이 그 값을 출력으로 연결하는지 표시해 보세요. 시작 코드를 고치기 전에는 현재 코드가 무엇을 출력할지 먼저 적어야 합니다.",
      "worked_example": "이 풀이 예제는 TypeScript의 입력 파싱 규칙이 실제 코드에서 어디에 놓이는지 보여줍니다. 값이 준비되는 줄, 그 값을 읽는 표현식, 출력으로 이어지는 줄을 분리해서 읽어 보세요.",
      "common_mistakes": [
        "입력 파싱의 역할을 보지 않고 예제 모양만 복사하는 것",
        "TypeScript 시작 코드의 현재 출력을 확인하지 않고 바로 수정하는 것",
        "이번 단원이 연습하는 규칙보다 괄호나 철자만 먼저 고치는 것"
      ],
      "self_check": [
        "예제에서 출력될 값을 만드는 표현식은 어디인가요?",
        "그 값이 비어 있거나 타입이 다르면 어떤 결과가 나올까요?",
        "시작 코드에서 입력 파싱 규칙과 직접 연결된 한 줄은 무엇인가요?"
      ],
      "exercise_prompt": "TypeScript의 입력 파싱 실습을 완성하세요. 시작 코드의 현재 출력을 먼저 예측한 뒤, 이 단원의 규칙과 연결된 부분만 수정하세요. 기대 출력을 상수로 붙여 넣지 마세요."
    },
    "ts-arrays-objects": {
      "title": "배열과 객체",
      "concept": "배열은 순서가 있는 값의 묶음입니다. TypeScript에서 배열과 객체을 익힐 때는 예제의 어느 줄이 값을 만들고 어느 줄이 그 값을 출력으로 연결하는지 표시해 보세요. 시작 코드를 고치기 전에는 현재 코드가 무엇을 출력할지 먼저 적어야 합니다.",
      "worked_example": "이 풀이 예제는 TypeScript의 배열과 객체 규칙이 실제 코드에서 어디에 놓이는지 보여줍니다. 값이 준비되는 줄, 그 값을 읽는 표현식, 출력으로 이어지는 줄을 분리해서 읽어 보세요.",
      "common_mistakes": [
        "배열과 객체의 역할을 보지 않고 예제 모양만 복사하는 것",
        "TypeScript 시작 코드의 현재 출력을 확인하지 않고 바로 수정하는 것",
        "이번 단원이 연습하는 규칙보다 괄호나 철자만 먼저 고치는 것"
      ],
      "self_check": [
        "예제에서 출력될 값을 만드는 표현식은 어디인가요?",
        "그 값이 비어 있거나 타입이 다르면 어떤 결과가 나올까요?",
        "시작 코드에서 배열과 객체 규칙과 직접 연결된 한 줄은 무엇인가요?"
      ],
      "exercise_prompt": "TypeScript의 배열과 객체 실습을 완성하세요. 시작 코드의 현재 출력을 먼저 예측한 뒤, 이 단원의 규칙과 연결된 부분만 수정하세요. 기대 출력을 상수로 붙여 넣지 마세요."
    },
    "ts-errors-async": {
      "title": "오류와 비동기",
      "concept": "try/catch는 오류를 처리하고 async는 Promise 흐름을 감쌉니다. TypeScript에서 오류와 비동기을 익힐 때는 예제의 어느 줄이 값을 만들고 어느 줄이 그 값을 출력으로 연결하는지 표시해 보세요. 시작 코드를 고치기 전에는 현재 코드가 무엇을 출력할지 먼저 적어야 합니다.",
      "worked_example": "이 풀이 예제는 TypeScript의 오류와 비동기 규칙이 실제 코드에서 어디에 놓이는지 보여줍니다. 값이 준비되는 줄, 그 값을 읽는 표현식, 출력으로 이어지는 줄을 분리해서 읽어 보세요.",
      "common_mistakes": [
        "오류와 비동기의 역할을 보지 않고 예제 모양만 복사하는 것",
        "TypeScript 시작 코드의 현재 출력을 확인하지 않고 바로 수정하는 것",
        "이번 단원이 연습하는 규칙보다 괄호나 철자만 먼저 고치는 것"
      ],
      "self_check": [
        "예제에서 출력될 값을 만드는 표현식은 어디인가요?",
        "그 값이 비어 있거나 타입이 다르면 어떤 결과가 나올까요?",
        "시작 코드에서 오류와 비동기 규칙과 직접 연결된 한 줄은 무엇인가요?"
      ],
      "exercise_prompt": "TypeScript의 오류와 비동기 실습을 완성하세요. 시작 코드의 현재 출력을 먼저 예측한 뒤, 이 단원의 규칙과 연결된 부분만 수정하세요. 기대 출력을 상수로 붙여 넣지 마세요."
    },
    "ts-narrowing": {
      "title": "타입 좁히기",
      "concept": "타입 가드는 union 값을 더 구체적인 타입으로 좁힙니다. TypeScript에서 타입 좁히기을 익힐 때는 예제의 어느 줄이 값을 만들고 어느 줄이 그 값을 출력으로 연결하는지 표시해 보세요. 시작 코드를 고치기 전에는 현재 코드가 무엇을 출력할지 먼저 적어야 합니다.",
      "worked_example": "이 풀이 예제는 TypeScript의 타입 좁히기 규칙이 실제 코드에서 어디에 놓이는지 보여줍니다. 값이 준비되는 줄, 그 값을 읽는 표현식, 출력으로 이어지는 줄을 분리해서 읽어 보세요.",
      "common_mistakes": [
        "타입 좁히기의 역할을 보지 않고 예제 모양만 복사하는 것",
        "TypeScript 시작 코드의 현재 출력을 확인하지 않고 바로 수정하는 것",
        "이번 단원이 연습하는 규칙보다 괄호나 철자만 먼저 고치는 것"
      ],
      "self_check": [
        "예제에서 출력될 값을 만드는 표현식은 어디인가요?",
        "그 값이 비어 있거나 타입이 다르면 어떤 결과가 나올까요?",
        "시작 코드에서 타입 좁히기 규칙과 직접 연결된 한 줄은 무엇인가요?"
      ],
      "exercise_prompt": "TypeScript의 타입 좁히기 실습을 완성하세요. 시작 코드의 현재 출력을 먼저 예측한 뒤, 이 단원의 규칙과 연결된 부분만 수정하세요. 기대 출력을 상수로 붙여 넣지 마세요."
    },
    "ts-generics": {
      "title": "제네릭",
      "concept": "제네릭은 재사용 코드에서도 타입 정보를 보존합니다. TypeScript에서 제네릭을 익힐 때는 예제의 어느 줄이 값을 만들고 어느 줄이 그 값을 출력으로 연결하는지 표시해 보세요. 시작 코드를 고치기 전에는 현재 코드가 무엇을 출력할지 먼저 적어야 합니다.",
      "worked_example": "이 풀이 예제는 TypeScript의 제네릭 규칙이 실제 코드에서 어디에 놓이는지 보여줍니다. 값이 준비되는 줄, 그 값을 읽는 표현식, 출력으로 이어지는 줄을 분리해서 읽어 보세요.",
      "common_mistakes": [
        "제네릭의 역할을 보지 않고 예제 모양만 복사하는 것",
        "TypeScript 시작 코드의 현재 출력을 확인하지 않고 바로 수정하는 것",
        "이번 단원이 연습하는 규칙보다 괄호나 철자만 먼저 고치는 것"
      ],
      "self_check": [
        "예제에서 출력될 값을 만드는 표현식은 어디인가요?",
        "그 값이 비어 있거나 타입이 다르면 어떤 결과가 나올까요?",
        "시작 코드에서 제네릭 규칙과 직접 연결된 한 줄은 무엇인가요?"
      ],
      "exercise_prompt": "TypeScript의 제네릭 실습을 완성하세요. 시작 코드의 현재 출력을 먼저 예측한 뒤, 이 단원의 규칙과 연결된 부분만 수정하세요. 기대 출력을 상수로 붙여 넣지 마세요."
    },
    "ts-mapped": {
      "title": "매핑된 타입",
      "concept": "매핑된 타입은 객체 속성을 규칙에 따라 변환합니다. TypeScript에서 매핑된 타입을 익힐 때는 예제의 어느 줄이 값을 만들고 어느 줄이 그 값을 출력으로 연결하는지 표시해 보세요. 시작 코드를 고치기 전에는 현재 코드가 무엇을 출력할지 먼저 적어야 합니다.",
      "worked_example": "이 풀이 예제는 TypeScript의 매핑된 타입 규칙이 실제 코드에서 어디에 놓이는지 보여줍니다. 값이 준비되는 줄, 그 값을 읽는 표현식, 출력으로 이어지는 줄을 분리해서 읽어 보세요.",
      "common_mistakes": [
        "매핑된 타입의 역할을 보지 않고 예제 모양만 복사하는 것",
        "TypeScript 시작 코드의 현재 출력을 확인하지 않고 바로 수정하는 것",
        "이번 단원이 연습하는 규칙보다 괄호나 철자만 먼저 고치는 것"
      ],
      "self_check": [
        "예제에서 출력될 값을 만드는 표현식은 어디인가요?",
        "그 값이 비어 있거나 타입이 다르면 어떤 결과가 나올까요?",
        "시작 코드에서 매핑된 타입 규칙과 직접 연결된 한 줄은 무엇인가요?"
      ],
      "exercise_prompt": "TypeScript의 매핑된 타입 실습을 완성하세요. 시작 코드의 현재 출력을 먼저 예측한 뒤, 이 단원의 규칙과 연결된 부분만 수정하세요. 기대 출력을 상수로 붙여 넣지 마세요."
    },
    "ts-conditional": {
      "title": "조건부 타입",
      "concept": "조건부 타입은 다른 타입을 기준으로 타입을 선택합니다. TypeScript에서 조건부 타입을 익힐 때는 예제의 어느 줄이 값을 만들고 어느 줄이 그 값을 출력으로 연결하는지 표시해 보세요. 시작 코드를 고치기 전에는 현재 코드가 무엇을 출력할지 먼저 적어야 합니다.",
      "worked_example": "이 풀이 예제는 TypeScript의 조건부 타입 규칙이 실제 코드에서 어디에 놓이는지 보여줍니다. 값이 준비되는 줄, 그 값을 읽는 표현식, 출력으로 이어지는 줄을 분리해서 읽어 보세요.",
      "common_mistakes": [
        "조건부 타입의 역할을 보지 않고 예제 모양만 복사하는 것",
        "TypeScript 시작 코드의 현재 출력을 확인하지 않고 바로 수정하는 것",
        "이번 단원이 연습하는 규칙보다 괄호나 철자만 먼저 고치는 것"
      ],
      "self_check": [
        "예제에서 출력될 값을 만드는 표현식은 어디인가요?",
        "그 값이 비어 있거나 타입이 다르면 어떤 결과가 나올까요?",
        "시작 코드에서 조건부 타입 규칙과 직접 연결된 한 줄은 무엇인가요?"
      ],
      "exercise_prompt": "TypeScript의 조건부 타입 실습을 완성하세요. 시작 코드의 현재 출력을 먼저 예측한 뒤, 이 단원의 규칙과 연결된 부분만 수정하세요. 기대 출력을 상수로 붙여 넣지 마세요."
    }
  }
}
