{
  "schema_version": 1,
  "programming_language": "python",
  "ui_language": "zh",
  "lessons": {
    "py-output": {
      "title": "输出",
      "concept": "使用 print 将值作为一行输出到屏幕。 在Python中学习输出时，不要只记语法名称，而要沿着示例里的值流动来理解：值在哪里创建，哪个表达式读取或改变它，最后什么内容进入标准输出。修改练习前，先预测运行结果。",
      "worked_example": "这个讲解示例用最小但可观察的代码展示Python里的输出。先看语法形状，再从值被创建的位置一路追到输出的位置。",
      "common_mistakes": [
        "只背示例代码，而没有理解输出背后的值流动",
        "还没预测输出，就直接改动Python 的起始代码",
        "忽略Python中输出的规则，只盯着括号或标点修改"
      ],
      "self_check": [
        "你能说出输出前一刻准备好的值是什么吗？",
        "你能指出哪一行真正用到了Python的输出语法吗？",
        "如果只能先改 起始代码的一个位置，你会先改哪里？"
      ],
      "exercise_prompt": "完成Python的输出练习。先预测起始代码会输出什么，再只修改必要的小部分。不要把期望输出直接硬编码成常量。"
    },
    "py-variables": {
      "title": "变量",
      "concept": "名称绑定到值，也可以之后重新绑定到其他值。 在Python中学习变量时，不要只记语法名称，而要沿着示例里的值流动来理解：值在哪里创建，哪个表达式读取或改变它，最后什么内容进入标准输出。修改练习前，先预测运行结果。",
      "worked_example": "这个讲解示例用最小但可观察的代码展示Python里的变量。先看语法形状，再从值被创建的位置一路追到输出的位置。",
      "common_mistakes": [
        "只背示例代码，而没有理解变量背后的值流动",
        "还没预测输出，就直接改动Python 的起始代码",
        "忽略Python中变量的规则，只盯着括号或标点修改"
      ],
      "self_check": [
        "你能说出输出前一刻准备好的值是什么吗？",
        "你能指出哪一行真正用到了Python的变量语法吗？",
        "如果只能先改 起始代码的一个位置，你会先改哪里？"
      ],
      "exercise_prompt": "完成Python的变量练习。先预测起始代码会输出什么，再只修改必要的小部分。不要把期望输出直接硬编码成常量。"
    },
    "py-strings": {
      "title": "字符串",
      "concept": "字符串支持长度、索引、切片和遍历。 在Python中学习字符串时，不要只记语法名称，而要沿着示例里的值流动来理解：值在哪里创建，哪个表达式读取或改变它，最后什么内容进入标准输出。修改练习前，先预测运行结果。",
      "worked_example": "这个讲解示例用最小但可观察的代码展示Python里的字符串。先看语法形状，再从值被创建的位置一路追到输出的位置。",
      "common_mistakes": [
        "只背示例代码，而没有理解字符串背后的值流动",
        "还没预测输出，就直接改动Python 的起始代码",
        "忽略Python中字符串的规则，只盯着括号或标点修改"
      ],
      "self_check": [
        "你能说出输出前一刻准备好的值是什么吗？",
        "你能指出哪一行真正用到了Python的字符串语法吗？",
        "如果只能先改 起始代码的一个位置，你会先改哪里？"
      ],
      "exercise_prompt": "完成Python的字符串练习。先预测起始代码会输出什么，再只修改必要的小部分。不要把期望输出直接硬编码成常量。"
    },
    "py-control-flow": {
      "title": "控制流",
      "concept": "用 if、for、while 表达选择和重复。 在Python中学习控制流时，不要只记语法名称，而要沿着示例里的值流动来理解：值在哪里创建，哪个表达式读取或改变它，最后什么内容进入标准输出。修改练习前，先预测运行结果。",
      "worked_example": "这个讲解示例用最小但可观察的代码展示Python里的控制流。先看语法形状，再从值被创建的位置一路追到输出的位置。",
      "common_mistakes": [
        "只背示例代码，而没有理解控制流背后的值流动",
        "还没预测输出，就直接改动Python 的起始代码",
        "忽略Python中控制流的规则，只盯着括号或标点修改"
      ],
      "self_check": [
        "你能说出输出前一刻准备好的值是什么吗？",
        "你能指出哪一行真正用到了Python的控制流语法吗？",
        "如果只能先改 起始代码的一个位置，你会先改哪里？"
      ],
      "exercise_prompt": "完成Python的控制流练习。先预测起始代码会输出什么，再只修改必要的小部分。不要把期望输出直接硬编码成常量。"
    },
    "py-functions": {
      "title": "函数",
      "concept": "用 def 创建带参数和返回值的可复用行为。 在Python中学习函数时，不要只记语法名称，而要沿着示例里的值流动来理解：值在哪里创建，哪个表达式读取或改变它，最后什么内容进入标准输出。修改练习前，先预测运行结果。",
      "worked_example": "这个讲解示例用最小但可观察的代码展示Python里的函数。先看语法形状，再从值被创建的位置一路追到输出的位置。",
      "common_mistakes": [
        "只背示例代码，而没有理解函数背后的值流动",
        "还没预测输出，就直接改动Python 的起始代码",
        "忽略Python中函数的规则，只盯着括号或标点修改"
      ],
      "self_check": [
        "你能说出输出前一刻准备好的值是什么吗？",
        "你能指出哪一行真正用到了Python的函数语法吗？",
        "如果只能先改 起始代码的一个位置，你会先改哪里？"
      ],
      "exercise_prompt": "完成Python的函数练习。先预测起始代码会输出什么，再只修改必要的小部分。不要把期望输出直接硬编码成常量。"
    },
    "py-input": {
      "title": "输入解析",
      "concept": "用 sys.stdin 和 split 处理竞赛式输入。 在Python中学习输入解析时，不要只记语法名称，而要沿着示例里的值流动来理解：值在哪里创建，哪个表达式读取或改变它，最后什么内容进入标准输出。修改练习前，先预测运行结果。",
      "worked_example": "这个讲解示例用最小但可观察的代码展示Python里的输入解析。先看语法形状，再从值被创建的位置一路追到输出的位置。",
      "common_mistakes": [
        "只背示例代码，而没有理解输入解析背后的值流动",
        "还没预测输出，就直接改动Python 的起始代码",
        "忽略Python中输入解析的规则，只盯着括号或标点修改"
      ],
      "self_check": [
        "你能说出输出前一刻准备好的值是什么吗？",
        "你能指出哪一行真正用到了Python的输入解析语法吗？",
        "如果只能先改 起始代码的一个位置，你会先改哪里？"
      ],
      "exercise_prompt": "完成Python的输入解析练习。先预测起始代码会输出什么，再只修改必要的小部分。不要把期望输出直接硬编码成常量。"
    },
    "py-lists-dicts": {
      "title": "列表和字典",
      "concept": "列表保留顺序，字典把键映射到值。 在Python中学习列表和字典时，不要只记语法名称，而要沿着示例里的值流动来理解：值在哪里创建，哪个表达式读取或改变它，最后什么内容进入标准输出。修改练习前，先预测运行结果。",
      "worked_example": "这个讲解示例用最小但可观察的代码展示Python里的列表和字典。先看语法形状，再从值被创建的位置一路追到输出的位置。",
      "common_mistakes": [
        "只背示例代码，而没有理解列表和字典背后的值流动",
        "还没预测输出，就直接改动Python 的起始代码",
        "忽略Python中列表和字典的规则，只盯着括号或标点修改"
      ],
      "self_check": [
        "你能说出输出前一刻准备好的值是什么吗？",
        "你能指出哪一行真正用到了Python的列表和字典语法吗？",
        "如果只能先改 起始代码的一个位置，你会先改哪里？"
      ],
      "exercise_prompt": "完成Python的列表和字典练习。先预测起始代码会输出什么，再只修改必要的小部分。不要把期望输出直接硬编码成常量。"
    },
    "py-errors": {
      "title": "异常",
      "concept": "用 try 和 except 处理可恢复的失败。 在Python中学习异常时，不要只记语法名称，而要沿着示例里的值流动来理解：值在哪里创建，哪个表达式读取或改变它，最后什么内容进入标准输出。修改练习前，先预测运行结果。",
      "worked_example": "这个讲解示例用最小但可观察的代码展示Python里的异常。先看语法形状，再从值被创建的位置一路追到输出的位置。",
      "common_mistakes": [
        "只背示例代码，而没有理解异常背后的值流动",
        "还没预测输出，就直接改动Python 的起始代码",
        "忽略Python中异常的规则，只盯着括号或标点修改"
      ],
      "self_check": [
        "你能说出输出前一刻准备好的值是什么吗？",
        "你能指出哪一行真正用到了Python的异常语法吗？",
        "如果只能先改 起始代码的一个位置，你会先改哪里？"
      ],
      "exercise_prompt": "完成Python的异常练习。先预测起始代码会输出什么，再只修改必要的小部分。不要把期望输出直接硬编码成常量。"
    },
    "py-comprehensions": {
      "title": "推导式",
      "concept": "推导式用表达式简洁地构建集合。 在Python中学习推导式时，不要只记语法名称，而要沿着示例里的值流动来理解：值在哪里创建，哪个表达式读取或改变它，最后什么内容进入标准输出。修改练习前，先预测运行结果。",
      "worked_example": "这个讲解示例用最小但可观察的代码展示Python里的推导式。先看语法形状，再从值被创建的位置一路追到输出的位置。",
      "common_mistakes": [
        "只背示例代码，而没有理解推导式背后的值流动",
        "还没预测输出，就直接改动Python 的起始代码",
        "忽略Python中推导式的规则，只盯着括号或标点修改"
      ],
      "self_check": [
        "你能说出输出前一刻准备好的值是什么吗？",
        "你能指出哪一行真正用到了Python的推导式语法吗？",
        "如果只能先改 起始代码的一个位置，你会先改哪里？"
      ],
      "exercise_prompt": "完成Python的推导式练习。先预测起始代码会输出什么，再只修改必要的小部分。不要把期望输出直接硬编码成常量。"
    },
    "py-generators": {
      "title": "迭代器和生成器",
      "concept": "yield 创建按需产生值的序列。 在Python中学习迭代器和生成器时，不要只记语法名称，而要沿着示例里的值流动来理解：值在哪里创建，哪个表达式读取或改变它，最后什么内容进入标准输出。修改练习前，先预测运行结果。",
      "worked_example": "这个讲解示例用最小但可观察的代码展示Python里的迭代器和生成器。先看语法形状，再从值被创建的位置一路追到输出的位置。",
      "common_mistakes": [
        "只背示例代码，而没有理解迭代器和生成器背后的值流动",
        "还没预测输出，就直接改动Python 的起始代码",
        "忽略Python中迭代器和生成器的规则，只盯着括号或标点修改"
      ],
      "self_check": [
        "你能说出输出前一刻准备好的值是什么吗？",
        "你能指出哪一行真正用到了Python的迭代器和生成器语法吗？",
        "如果只能先改 起始代码的一个位置，你会先改哪里？"
      ],
      "exercise_prompt": "完成Python的迭代器和生成器练习。先预测起始代码会输出什么，再只修改必要的小部分。不要把期望输出直接硬编码成常量。"
    },
    "py-decorators": {
      "title": "装饰器",
      "concept": "装饰器在函数定义时包裹函数并扩展行为。 在Python中学习装饰器时，不要只记语法名称，而要沿着示例里的值流动来理解：值在哪里创建，哪个表达式读取或改变它，最后什么内容进入标准输出。修改练习前，先预测运行结果。",
      "worked_example": "这个讲解示例用最小但可观察的代码展示Python里的装饰器。先看语法形状，再从值被创建的位置一路追到输出的位置。",
      "common_mistakes": [
        "只背示例代码，而没有理解装饰器背后的值流动",
        "还没预测输出，就直接改动Python 的起始代码",
        "忽略Python中装饰器的规则，只盯着括号或标点修改"
      ],
      "self_check": [
        "你能说出输出前一刻准备好的值是什么吗？",
        "你能指出哪一行真正用到了Python的装饰器语法吗？",
        "如果只能先改 起始代码的一个位置，你会先改哪里？"
      ],
      "exercise_prompt": "完成Python的装饰器练习。先预测起始代码会输出什么，再只修改必要的小部分。不要把期望输出直接硬编码成常量。"
    },
    "py-context-types": {
      "title": "上下文管理器和类型提示",
      "concept": "with 管理作用域内的资源，类型提示说明预期类型。 在Python中学习上下文管理器和类型提示时，不要只记语法名称，而要沿着示例里的值流动来理解：值在哪里创建，哪个表达式读取或改变它，最后什么内容进入标准输出。修改练习前，先预测运行结果。",
      "worked_example": "这个讲解示例用最小但可观察的代码展示Python里的上下文管理器和类型提示。先看语法形状，再从值被创建的位置一路追到输出的位置。",
      "common_mistakes": [
        "只背示例代码，而没有理解上下文管理器和类型提示背后的值流动",
        "还没预测输出，就直接改动Python 的起始代码",
        "忽略Python中上下文管理器和类型提示的规则，只盯着括号或标点修改"
      ],
      "self_check": [
        "你能说出输出前一刻准备好的值是什么吗？",
        "你能指出哪一行真正用到了Python的上下文管理器和类型提示语法吗？",
        "如果只能先改 起始代码的一个位置，你会先改哪里？"
      ],
      "exercise_prompt": "完成Python的上下文管理器和类型提示练习。先预测起始代码会输出什么，再只修改必要的小部分。不要把期望输出直接硬编码成常量。"
    }
  }
}
