{
  "schema_version": 1,
  "programming_language": "java",
  "ui_language": "zh",
  "lessons": {
    "java-output": {
      "title": "输出",
      "concept": "System.out.println 输出一行。 在Java中学习输出时，先分清示例中哪一行创建值，哪个表达式读取它，哪一行把结果送到输出。修改起始代码前，先写下当前代码会输出什么。",
      "worked_example": "这个讲解示例用来定位Java里输出规则出现的位置。按顺序观察创建值的行、读取值的表达式，以及产生输出的语句。",
      "common_mistakes": [
        "只复制示例形状，却说不清输出在代码中的作用",
        "没有确认Java起始代码当前输出，就直接开始修改",
        "只改括号或标点，而没有应用本课真正练习的规则"
      ],
      "self_check": [
        "示例中哪个表达式创建了最终要输出的值？",
        "如果这个值为空、缺失或类型不对，会发生什么？",
        "起始代码中哪一行和输出规则直接相关？"
      ],
      "exercise_prompt": "完成Java的输出练习。先预测起始代码当前会输出什么，再只修改和本课规则相关的部分。不要把期望输出直接写成常量。"
    },
    "java-variables": {
      "title": "变量",
      "concept": "Java 变量有声明的类型。 在Java中学习变量时，先分清示例中哪一行创建值，哪个表达式读取它，哪一行把结果送到输出。修改起始代码前，先写下当前代码会输出什么。",
      "worked_example": "这个讲解示例用来定位Java里变量规则出现的位置。按顺序观察创建值的行、读取值的表达式，以及产生输出的语句。",
      "common_mistakes": [
        "只复制示例形状，却说不清变量在代码中的作用",
        "没有确认Java起始代码当前输出，就直接开始修改",
        "只改括号或标点，而没有应用本课真正练习的规则"
      ],
      "self_check": [
        "示例中哪个表达式创建了最终要输出的值？",
        "如果这个值为空、缺失或类型不对，会发生什么？",
        "起始代码中哪一行和变量规则直接相关？"
      ],
      "exercise_prompt": "完成Java的变量练习。先预测起始代码当前会输出什么，再只修改和本课规则相关的部分。不要把期望输出直接写成常量。"
    },
    "java-strings": {
      "title": "字符串",
      "concept": "String 方法提供长度、字符和子字符串操作。 在Java中学习字符串时，先分清示例中哪一行创建值，哪个表达式读取它，哪一行把结果送到输出。修改起始代码前，先写下当前代码会输出什么。",
      "worked_example": "这个讲解示例用来定位Java里字符串规则出现的位置。按顺序观察创建值的行、读取值的表达式，以及产生输出的语句。",
      "common_mistakes": [
        "只复制示例形状，却说不清字符串在代码中的作用",
        "没有确认Java起始代码当前输出，就直接开始修改",
        "只改括号或标点，而没有应用本课真正练习的规则"
      ],
      "self_check": [
        "示例中哪个表达式创建了最终要输出的值？",
        "如果这个值为空、缺失或类型不对，会发生什么？",
        "起始代码中哪一行和字符串规则直接相关？"
      ],
      "exercise_prompt": "完成Java的字符串练习。先预测起始代码当前会输出什么，再只修改和本课规则相关的部分。不要把期望输出直接写成常量。"
    },
    "java-control-flow": {
      "title": "控制流",
      "concept": "if、for、while 控制执行流程。 在Java中学习控制流时，先分清示例中哪一行创建值，哪个表达式读取它，哪一行把结果送到输出。修改起始代码前，先写下当前代码会输出什么。",
      "worked_example": "这个讲解示例用来定位Java里控制流规则出现的位置。按顺序观察创建值的行、读取值的表达式，以及产生输出的语句。",
      "common_mistakes": [
        "只复制示例形状，却说不清控制流在代码中的作用",
        "没有确认Java起始代码当前输出，就直接开始修改",
        "只改括号或标点，而没有应用本课真正练习的规则"
      ],
      "self_check": [
        "示例中哪个表达式创建了最终要输出的值？",
        "如果这个值为空、缺失或类型不对，会发生什么？",
        "起始代码中哪一行和控制流规则直接相关？"
      ],
      "exercise_prompt": "完成Java的控制流练习。先预测起始代码当前会输出什么，再只修改和本课规则相关的部分。不要把期望输出直接写成常量。"
    },
    "java-methods": {
      "title": "方法",
      "concept": "方法组织可复用行为。 在Java中学习方法时，先分清示例中哪一行创建值，哪个表达式读取它，哪一行把结果送到输出。修改起始代码前，先写下当前代码会输出什么。",
      "worked_example": "这个讲解示例用来定位Java里方法规则出现的位置。按顺序观察创建值的行、读取值的表达式，以及产生输出的语句。",
      "common_mistakes": [
        "只复制示例形状，却说不清方法在代码中的作用",
        "没有确认Java起始代码当前输出，就直接开始修改",
        "只改括号或标点，而没有应用本课真正练习的规则"
      ],
      "self_check": [
        "示例中哪个表达式创建了最终要输出的值？",
        "如果这个值为空、缺失或类型不对，会发生什么？",
        "起始代码中哪一行和方法规则直接相关？"
      ],
      "exercise_prompt": "完成Java的方法练习。先预测起始代码当前会输出什么，再只修改和本课规则相关的部分。不要把期望输出直接写成常量。"
    },
    "java-input": {
      "title": "输入解析",
      "concept": "练习中可以直接读取 System.in 处理输入。 在Java中学习输入解析时，先分清示例中哪一行创建值，哪个表达式读取它，哪一行把结果送到输出。修改起始代码前，先写下当前代码会输出什么。",
      "worked_example": "这个讲解示例用来定位Java里输入解析规则出现的位置。按顺序观察创建值的行、读取值的表达式，以及产生输出的语句。",
      "common_mistakes": [
        "只复制示例形状，却说不清输入解析在代码中的作用",
        "没有确认Java起始代码当前输出，就直接开始修改",
        "只改括号或标点，而没有应用本课真正练习的规则"
      ],
      "self_check": [
        "示例中哪个表达式创建了最终要输出的值？",
        "如果这个值为空、缺失或类型不对，会发生什么？",
        "起始代码中哪一行和输入解析规则直接相关？"
      ],
      "exercise_prompt": "完成Java的输入解析练习。先预测起始代码当前会输出什么，再只修改和本课规则相关的部分。不要把期望输出直接写成常量。"
    },
    "java-arrays-collections": {
      "title": "数组和集合",
      "concept": "数组大小固定，集合提供更灵活的容器。 在Java中学习数组和集合时，先分清示例中哪一行创建值，哪个表达式读取它，哪一行把结果送到输出。修改起始代码前，先写下当前代码会输出什么。",
      "worked_example": "这个讲解示例用来定位Java里数组和集合规则出现的位置。按顺序观察创建值的行、读取值的表达式，以及产生输出的语句。",
      "common_mistakes": [
        "只复制示例形状，却说不清数组和集合在代码中的作用",
        "没有确认Java起始代码当前输出，就直接开始修改",
        "只改括号或标点，而没有应用本课真正练习的规则"
      ],
      "self_check": [
        "示例中哪个表达式创建了最终要输出的值？",
        "如果这个值为空、缺失或类型不对，会发生什么？",
        "起始代码中哪一行和数组和集合规则直接相关？"
      ],
      "exercise_prompt": "完成Java的数组和集合练习。先预测起始代码当前会输出什么，再只修改和本课规则相关的部分。不要把期望输出直接写成常量。"
    },
    "java-exceptions": {
      "title": "异常",
      "concept": "try/catch 处理失败，受检异常会体现在签名中。 在Java中学习异常时，先分清示例中哪一行创建值，哪个表达式读取它，哪一行把结果送到输出。修改起始代码前，先写下当前代码会输出什么。",
      "worked_example": "这个讲解示例用来定位Java里异常规则出现的位置。按顺序观察创建值的行、读取值的表达式，以及产生输出的语句。",
      "common_mistakes": [
        "只复制示例形状，却说不清异常在代码中的作用",
        "没有确认Java起始代码当前输出，就直接开始修改",
        "只改括号或标点，而没有应用本课真正练习的规则"
      ],
      "self_check": [
        "示例中哪个表达式创建了最终要输出的值？",
        "如果这个值为空、缺失或类型不对，会发生什么？",
        "起始代码中哪一行和异常规则直接相关？"
      ],
      "exercise_prompt": "完成Java的异常练习。先预测起始代码当前会输出什么，再只修改和本课规则相关的部分。不要把期望输出直接写成常量。"
    },
    "java-classes-interfaces": {
      "title": "类和接口",
      "concept": "类保存状态和行为，接口描述行为契约。 在Java中学习类和接口时，先分清示例中哪一行创建值，哪个表达式读取它，哪一行把结果送到输出。修改起始代码前，先写下当前代码会输出什么。",
      "worked_example": "这个讲解示例用来定位Java里类和接口规则出现的位置。按顺序观察创建值的行、读取值的表达式，以及产生输出的语句。",
      "common_mistakes": [
        "只复制示例形状，却说不清类和接口在代码中的作用",
        "没有确认Java起始代码当前输出，就直接开始修改",
        "只改括号或标点，而没有应用本课真正练习的规则"
      ],
      "self_check": [
        "示例中哪个表达式创建了最终要输出的值？",
        "如果这个值为空、缺失或类型不对，会发生什么？",
        "起始代码中哪一行和类和接口规则直接相关？"
      ],
      "exercise_prompt": "完成Java的类和接口练习。先预测起始代码当前会输出什么，再只修改和本课规则相关的部分。不要把期望输出直接写成常量。"
    },
    "java-generics": {
      "title": "泛型",
      "concept": "泛型通过类型参数复用代码。 在Java中学习泛型时，先分清示例中哪一行创建值，哪个表达式读取它，哪一行把结果送到输出。修改起始代码前，先写下当前代码会输出什么。",
      "worked_example": "这个讲解示例用来定位Java里泛型规则出现的位置。按顺序观察创建值的行、读取值的表达式，以及产生输出的语句。",
      "common_mistakes": [
        "只复制示例形状，却说不清泛型在代码中的作用",
        "没有确认Java起始代码当前输出，就直接开始修改",
        "只改括号或标点，而没有应用本课真正练习的规则"
      ],
      "self_check": [
        "示例中哪个表达式创建了最终要输出的值？",
        "如果这个值为空、缺失或类型不对，会发生什么？",
        "起始代码中哪一行和泛型规则直接相关？"
      ],
      "exercise_prompt": "完成Java的泛型练习。先预测起始代码当前会输出什么，再只修改和本课规则相关的部分。不要把期望输出直接写成常量。"
    },
    "java-lambda-streams": {
      "title": "Lambda 和流",
      "concept": "Lambda 传递行为，流处理序列。 在Java中学习Lambda 和流时，先分清示例中哪一行创建值，哪个表达式读取它，哪一行把结果送到输出。修改起始代码前，先写下当前代码会输出什么。",
      "worked_example": "这个讲解示例用来定位Java里Lambda 和流规则出现的位置。按顺序观察创建值的行、读取值的表达式，以及产生输出的语句。",
      "common_mistakes": [
        "只复制示例形状，却说不清Lambda 和流在代码中的作用",
        "没有确认Java起始代码当前输出，就直接开始修改",
        "只改括号或标点，而没有应用本课真正练习的规则"
      ],
      "self_check": [
        "示例中哪个表达式创建了最终要输出的值？",
        "如果这个值为空、缺失或类型不对，会发生什么？",
        "起始代码中哪一行和Lambda 和流规则直接相关？"
      ],
      "exercise_prompt": "完成Java的Lambda 和流练习。先预测起始代码当前会输出什么，再只修改和本课规则相关的部分。不要把期望输出直接写成常量。"
    },
    "java-records-sealed": {
      "title": "记录和 sealed 类型",
      "concept": "记录减少数据样板代码，sealed 类型限制继承范围。 在Java中学习记录和 sealed 类型时，先分清示例中哪一行创建值，哪个表达式读取它，哪一行把结果送到输出。修改起始代码前，先写下当前代码会输出什么。",
      "worked_example": "这个讲解示例用来定位Java里记录和 sealed 类型规则出现的位置。按顺序观察创建值的行、读取值的表达式，以及产生输出的语句。",
      "common_mistakes": [
        "只复制示例形状，却说不清记录和 sealed 类型在代码中的作用",
        "没有确认Java起始代码当前输出，就直接开始修改",
        "只改括号或标点，而没有应用本课真正练习的规则"
      ],
      "self_check": [
        "示例中哪个表达式创建了最终要输出的值？",
        "如果这个值为空、缺失或类型不对，会发生什么？",
        "起始代码中哪一行和记录和 sealed 类型规则直接相关？"
      ],
      "exercise_prompt": "完成Java的记录和 sealed 类型练习。先预测起始代码当前会输出什么，再只修改和本课规则相关的部分。不要把期望输出直接写成常量。"
    }
  }
}
