{
  "schema_version": 1,
  "programming_language": "python",
  "ui_language": "ko",
  "lessons": {
    "py-output": {
      "title": "출력",
      "concept": "출력은 프로그램이 계산한 결과를 밖으로 보여주는 통로입니다. Python에서는 `print(value)`가 `value`를 문자열 형태로 바꿔 표준 출력에 쓰고, 기본적으로 줄바꿈을 붙입니다.\n\n코딩 테스트에서는 표준 출력이 정확히 맞아야 채점이 통과됩니다. 계산이 맞아도 디버그 출력이 남아 있거나, 줄이 하나 더 있거나, 리스트 모양 그대로 출력하면 실패할 수 있습니다.",
      "worked_example": "`print('ok')`는 표준 출력에 `ok`를 한 줄로 보냅니다. 따옴표는 문자열을 만들기 위한 문법이고, 출력에는 따옴표가 포함되지 않습니다.",
      "common_mistakes": [
        "최종 코드에 디버그 print를 남기는 것",
        "채점기가 출력을 보는데 최상위 코드에서 return을 쓰는 것",
        "문제는 평문을 기대하는데 리스트 표현을 그대로 출력하는 것"
      ],
      "self_check": [
        "문자열 리터럴의 따옴표와 실제 출력되는 글자는 어떻게 다를까요?",
        "출력 한 줄이 추가되면 왜 맞는 알고리즘도 실패할 수 있을까요?"
      ],
      "exercise_prompt": "시작 코드가 정확히 `ok`만 출력하도록 만드세요. 실행하기 전에 먼저 출력을 예상하세요."
    },
    "py-variables": {
      "title": "변수",
      "concept": "변수 이름은 값을 가리키는 라벨입니다. `=`는 수학의 같다는 뜻이 아니라, 오른쪽 값을 왼쪽 이름에 묶는 대입입니다.\n\n변수는 중간 결과에 이름을 붙여 코드를 읽기 쉽게 만듭니다. 이름이 구체적이면 머릿속에 임시 값을 많이 들고 있지 않아도 됩니다.",
      "worked_example": "`count = 1`은 `count`라는 이름을 정수 `1`에 묶습니다. `print(count)`는 그 이름이 현재 가리키는 값을 읽어 출력합니다.",
      "common_mistakes": [
        "`=`를 동등 비교로 읽는 것",
        "서로 다른 의미의 값에 같은 애매한 이름을 계속 쓰는 것",
        "다시 대입한 뒤에도 예전 값이 남아 있다고 생각하는 것"
      ],
      "self_check": [
        "`x = 1` 다음 `x = x + 2`를 실행하면 `x`는 어떤 값을 가리킬까요?",
        "중간 결과에 이름을 붙이면 어떤 코드가 더 쉬워질까요?"
      ],
      "exercise_prompt": "값을 이름에 묶은 뒤 그 이름을 출력해 정확히 `ok`가 나오게 하세요. 먼저 출력을 예측한 뒤, 채점기가 기대하는 동작에 맞게 필요한 부분만 작게 수정하세요."
    },
    "py-strings": {
      "title": "문자열",
      "concept": "문자열은 순서가 있는 글자의 묶음입니다. `len(text)`는 길이를 주고, `text[i]`는 0부터 시작하는 인덱스로 한 글자를 읽으며, `text[a:b]`는 끝을 포함하지 않는 범위를 잘라 냅니다.\n\n문자열은 불변입니다. 어떤 연산이 문자열을 바꾸는 것처럼 보여도 보통 새 문자열을 만들거나 일부 글자를 읽는 것입니다.",
      "worked_example": "`text = 'code'`에서 `text[:2]`는 0번 인덱스부터 2번 인덱스 직전까지 읽어 `co`를 만듭니다.",
      "common_mistakes": [
        "인덱스가 1이 아니라 0부터 시작한다는 점을 잊는 것",
        "슬라이스의 끝 인덱스가 포함된다고 생각하는 것",
        "문자열의 한 글자를 직접 대입해 바꾸려는 것"
      ],
      "self_check": [
        "`'code'[1]`은 어떤 글자를 읽을까요?",
        "`'code'[:2]`가 왜 두 글자를 만들까요?"
      ],
      "exercise_prompt": "인덱싱이나 슬라이싱으로 정확히 `ok`를 출력하세요. 먼저 출력을 예측한 뒤, 채점기가 기대하는 동작에 맞게 필요한 부분만 작게 수정하세요."
    },
    "py-control-flow": {
      "title": "제어 흐름",
      "concept": "제어 흐름은 어떤 문장이 실행될지, 몇 번 실행될지를 정합니다. `if`는 조건에 따라 가지를 고르고, `for`는 시퀀스를 반복하며, `while`은 조건이 참인 동안 반복합니다.\n\nPython에서는 들여쓰기가 문법입니다. 들여쓴 블록은 바로 위의 제어문에 속합니다.",
      "worked_example": "`for n in range(3): print(n)`은 본문을 세 번 실행하고, `n`은 차례로 0, 1, 2가 됩니다.",
      "common_mistakes": [
        "문장을 잘못된 들여쓰기 레벨에 두는 것",
        "조건이 바뀌지 않는 while 루프를 만드는 것",
        "`range(n)`이 n까지 포함한다고 생각하는 것"
      ],
      "self_check": [
        "`range(3)`은 몇 번 반복될까요?",
        "어떤 줄들이 if 블록에 속하는지 어떻게 판단할까요?"
      ],
      "exercise_prompt": "분기나 반복을 사용해 정확히 `ok`를 출력하세요. 먼저 출력을 예측한 뒤, 채점기가 기대하는 동작에 맞게 필요한 부분만 작게 수정하세요."
    },
    "py-functions": {
      "title": "함수",
      "concept": "함수는 재사용할 동작에 이름을 붙인 것입니다. `def name(parameters):`로 정의하고, `name(arguments)`로 호출해야 본문이 실행됩니다.\n\n`return`은 값을 호출한 쪽으로 돌려줍니다. 함수 안에서 출력하는 것과 값을 반환하는 것은 다릅니다. 보통 계산은 반환값으로 이어가고, 최종 경계에서만 출력합니다.",
      "worked_example": "`def add(a, b): return a + b`는 두 인자를 받아 합을 돌려주는 함수를 만듭니다.",
      "common_mistakes": [
        "함수를 정의만 하고 호출하지 않는 것",
        "호출한 쪽이 값이 필요한데 print만 하는 것",
        "루프 안에서 너무 일찍 return하는 것"
      ],
      "self_check": [
        "함수가 return 없이 끝나면 어떤 값이 돌아갈까요?",
        "최종 출력은 보통 어디에서 하는 게 좋을까요?"
      ],
      "exercise_prompt": "작은 함수를 완성하고, 그 반환값을 출력하세요. 먼저 출력을 예측한 뒤, 채점기가 기대하는 동작에 맞게 필요한 부분만 작게 수정하세요."
    },
    "py-input": {
      "title": "입력 파싱",
      "concept": "대부분의 코딩 테스트 프로그램은 표준 입력을 읽고, 텍스트를 필요한 값으로 바꾼 뒤, 표준 출력에 답을 씁니다. `sys.stdin.read()`는 입력 전체를 문자열로 읽고, `.split()`은 공백 기준 토큰으로 나눕니다.\n\n파싱은 경계 작업입니다. 입력을 읽고 타입을 한 번 변환한 뒤, 풀이 로직은 일반 변수와 컬렉션으로 다루는 편이 읽기 쉽습니다.",
      "worked_example": "`list(map(int, sys.stdin.read().split()))`는 공백으로 나뉜 모든 토큰을 읽고 각각 정수로 바꿉니다.",
      "common_mistakes": [
        "입력이 여러 줄인데 무조건 input()만 반복하는 것",
        "표준 입력은 처음에 항상 텍스트라는 점을 잊는 것",
        "입력을 그대로 출력해야 하는 문제에서 공백과 줄바꿈을 잃어버리는 것"
      ],
      "self_check": [
        "`split()` 결과는 왜 int가 아니라 문자열일까요?",
        "언제 split하지 말고 입력을 그대로 보존해야 할까요?"
      ],
      "exercise_prompt": "표준 입력을 읽어 그대로 다시 출력하세요. 먼저 출력을 예측한 뒤, 채점기가 기대하는 동작에 맞게 필요한 부분만 작게 수정하세요."
    },
    "py-lists-dicts": {
      "title": "리스트와 딕셔너리",
      "concept": "리스트는 순서가 있는 값의 묶음입니다. 위치가 중요할 때 `nums[0]` 같은 인덱스로 값을 읽고, 리스트의 순서대로 반복할 수 있습니다.\n\n딕셔너리는 키를 값에 연결하는 자료구조입니다. 위치가 아니라 이름, id, 문자처럼 의미 있는 키로 값을 찾고 싶을 때 사용합니다.\n\n합계, 개수 세기, 그룹화, 빠른 조회를 할 때 어떤 컬렉션을 고르느냐가 코드의 단순함을 크게 바꿉니다.",
      "worked_example": "`counts = {'a': 2}`는 키 `'a'`와 값 `2`를 가진 딕셔너리를 만듭니다. `counts['a']`는 그 키에 연결된 값을 찾아 `2`를 출력합니다.",
      "common_mistakes": [
        "키로 식별되는 데이터를 억지로 리스트 인덱스로 찾는 것",
        "없는 딕셔너리 키를 확인 없이 조회하는 것",
        "리스트는 순서가 중요하고 딕셔너리는 키로 찾는다는 차이를 잊는 것"
      ],
      "self_check": [
        "언제 리스트 대신 딕셔너리를 써야 할까요?",
        "`nums[0]`과 `counts['a']`는 각각 무엇을 뜻할까요?",
        "여러 단어의 등장 횟수를 저장하려면 어떤 구조가 좋을까요?"
      ],
      "exercise_prompt": "시작 코드의 리스트를 사용해 숫자들의 합계를 출력하세요. 기대 출력 숫자를 그대로 하드코딩하지 마세요."
    },
    "py-errors": {
      "title": "예외",
      "concept": "예외는 정상 흐름을 계속할 수 없을 때 코드가 실패를 알리는 방식입니다. `try`는 실패할 수 있는 코드를 실행하고, `except SomeError`는 특정 실패를 처리합니다.\n\n복구할 수 있는 오류만 잡는 편이 좋습니다. 너무 넓게 잡으면 진짜 버그가 숨고, 연습 중 실패 원인을 찾기 어려워집니다.",
      "worked_example": "`int('x')`는 `ValueError`를 일으킵니다. `except ValueError` 블록은 프로그램이 죽는 대신 대체 동작을 하게 합니다.",
      "common_mistakes": [
        "맨 `except:`로 모든 예외를 잡는 것",
        "try 안에 너무 많은 코드를 넣어 실패 지점을 흐리는 것",
        "일반 조건문으로 충분한 일을 예외로 처리하는 것"
      ],
      "self_check": [
        "여기서 bare except보다 `except ValueError`가 왜 더 분명할까요?",
        "복구 가능한 파싱 실패 뒤에는 무엇을 해야 할까요?"
      ],
      "exercise_prompt": "예상되는 변환 오류를 처리해 정확히 `ok`를 출력하세요. 먼저 출력을 예측한 뒤, 채점기가 기대하는 동작에 맞게 필요한 부분만 작게 수정하세요."
    },
    "py-comprehensions": {
      "title": "컴프리헨션",
      "concept": "컴프리헨션은 표현식과 반복문으로 컬렉션을 만드는 문법입니다. `[expr for item in items if condition]`은 각 항목을 방문하고, 조건에 맞는 항목만 골라 표현식 결과를 저장한다는 뜻입니다.\n\n간단한 변환과 필터에는 좋지만, 단계가 많거나 부수 효과가 있으면 일반 for 루프가 더 읽기 쉽습니다.",
      "worked_example": "`[n for n in range(5) if n % 2 == 0]`은 짝수만 골라 `[0, 2, 4]`를 만듭니다.",
      "common_mistakes": [
        "컴프리헨션을 너무 빽빽하게 써서 루프보다 읽기 어렵게 만드는 것",
        "출력 표현식이 for 앞에 온다는 점을 잊는 것",
        "부수 효과만 위해 컴프리헨션을 쓰는 것"
      ],
      "self_check": [
        "어느 부분이 결과 값을 정할까요?",
        "어느 부분이 항목을 걸러낼까요?"
      ],
      "exercise_prompt": "컴프리헨션으로 필요한 텍스트를 만들어 정확히 `ok`를 출력하세요. 먼저 출력을 예측한 뒤, 채점기가 기대하는 동작에 맞게 필요한 부분만 작게 수정하세요."
    },
    "py-generators": {
      "title": "이터레이터와 제너레이터",
      "concept": "이터레이터는 값을 한 번에 하나씩 내놓는 객체입니다. 제너레이터 함수는 `yield`로 값을 내놓고 멈췄다가, 다음 값을 요청받으면 이어서 실행됩니다.\n\n시퀀스가 크거나 자연스럽게 흐름으로 처리될 때 제너레이터가 유용합니다. 전체 리스트를 먼저 만들지 않고 값 생산 방법을 표현할 수 있습니다.",
      "worked_example": "`def ones(): yield 1`은 제너레이터 객체를 만듭니다. `next(ones())`는 첫 번째 값을 요청합니다.",
      "common_mistakes": [
        "제너레이터 함수를 호출하면 본문이 즉시 실행된다고 생각하는 것",
        "`next`가 끝에서 `StopIteration`을 일으킬 수 있다는 점을 잊는 것",
        "짧은 리스트가 더 단순한데 제너레이터를 쓰는 것"
      ],
      "self_check": [
        "`return`과 `yield`는 어떻게 다를까요?",
        "제너레이터 본문은 언제 실제로 실행될까요?"
      ],
      "exercise_prompt": "첫 값을 요청했을 때 정확히 `ok`가 출력되도록 제너레이터를 완성하세요. 먼저 출력을 예측한 뒤, 채점기가 기대하는 동작에 맞게 필요한 부분만 작게 수정하세요."
    },
    "py-decorators": {
      "title": "데코레이터",
      "concept": "데코레이터는 함수를 정의하는 시점에 다른 함수로 감싸는 문법입니다. 함수 위의 `@decorator`는 그 함수를 `decorator(function)`의 결과로 바꾸는 축약형입니다.\n\n로깅, 캐싱, 검증, 프레임워크 훅에서 자주 쓰입니다. 먼저 원래 함수도 값이며, 다른 함수에 전달될 수 있다는 점을 이해해야 합니다.",
      "worked_example": "`def deco(fn): return fn`은 받은 함수를 그대로 돌려주는 항등 데코레이터입니다.",
      "common_mistakes": [
        "데코레이터가 함수 호출 시점이 아니라 정의 시점에 실행된다는 점을 잊는 것",
        "래퍼 함수를 반환해야 하는데 원래 함수를 호출한 결과를 반환하는 것",
        "일반 helper 함수가 더 단순한데 데코레이터를 추가하는 것"
      ],
      "self_check": [
        "데코레이터는 어떤 값을 받을까요?",
        "데코레이터는 무엇을 반환해야 할까요?"
      ],
      "exercise_prompt": "제공된 데코레이터 형태를 사용해 정확히 `ok`를 출력하세요. 먼저 출력을 예측한 뒤, 채점기가 기대하는 동작에 맞게 필요한 부분만 작게 수정하세요."
    },
    "py-context-types": {
      "title": "컨텍스트 매니저와 타입 힌트",
      "concept": "`with`는 관리되는 범위를 엽니다. 컨텍스트 매니저는 블록 전 설정을 하고, 블록 뒤 정리를 하며, 중간에 빠져나가도 정리 동작이 실행되도록 돕습니다.\n\n타입 힌트는 독자와 도구에게 값의 예상 형태를 알려줍니다. Python은 여전히 동적으로 실행되지만, 힌트가 있으면 실행 전 인터페이스를 더 쉽게 점검할 수 있습니다.",
      "worked_example": "`def total(xs: Iterable[int]) -> int: return sum(xs)`는 정수들을 반복할 수 있는 값을 받고 정수를 반환한다는 뜻을 드러냅니다.",
      "common_mistakes": [
        "타입 힌트가 모든 값을 런타임에 자동으로 강제한다고 생각하는 것",
        "`with`의 핵심이 설정과 정리라는 점을 잊는 것",
        "데이터 형태가 분명하지 않은데 복잡한 힌트부터 붙이는 것"
      ],
      "self_check": [
        "`with open(...)`은 어떤 문제를 해결할까요?",
        "`Iterable[int]`는 읽는 사람에게 무엇을 알려줄까요?"
      ],
      "exercise_prompt": "간단한 타입 힌트 상수를 사용해 정확히 `ok`를 출력하세요. 먼저 출력을 예측한 뒤, 채점기가 기대하는 동작에 맞게 필요한 부분만 작게 수정하세요."
    }
  }
}
