{
  "schema_version": 1,
  "programming_language": "ts",
  "ui_language": "zh",
  "lessons": {
    "ts-output": {
      "title": "输出",
      "concept": "console.log 输出一行。 在TypeScript中学习输出时，先分清示例中哪一行创建值，哪个表达式读取它，哪一行把结果送到输出。修改起始代码前，先写下当前代码会输出什么。",
      "worked_example": "这个讲解示例用来定位TypeScript里输出规则出现的位置。按顺序观察创建值的行、读取值的表达式，以及产生输出的语句。",
      "common_mistakes": [
        "只复制示例形状，却说不清输出在代码中的作用",
        "没有确认TypeScript起始代码当前输出，就直接开始修改",
        "只改括号或标点，而没有应用本课真正练习的规则"
      ],
      "self_check": [
        "示例中哪个表达式创建了最终要输出的值？",
        "如果这个值为空、缺失或类型不对，会发生什么？",
        "起始代码中哪一行和输出规则直接相关？"
      ],
      "exercise_prompt": "完成TypeScript的输出练习。先预测起始代码当前会输出什么，再只修改和本课规则相关的部分。不要把期望输出直接写成常量。"
    },
    "ts-variables": {
      "title": "变量",
      "concept": "let 可以重新赋值，const 不能重新赋值。 在TypeScript中学习变量时，先分清示例中哪一行创建值，哪个表达式读取它，哪一行把结果送到输出。修改起始代码前，先写下当前代码会输出什么。",
      "worked_example": "这个讲解示例用来定位TypeScript里变量规则出现的位置。按顺序观察创建值的行、读取值的表达式，以及产生输出的语句。",
      "common_mistakes": [
        "只复制示例形状，却说不清变量在代码中的作用",
        "没有确认TypeScript起始代码当前输出，就直接开始修改",
        "只改括号或标点，而没有应用本课真正练习的规则"
      ],
      "self_check": [
        "示例中哪个表达式创建了最终要输出的值？",
        "如果这个值为空、缺失或类型不对，会发生什么？",
        "起始代码中哪一行和变量规则直接相关？"
      ],
      "exercise_prompt": "完成TypeScript的变量练习。先预测起始代码当前会输出什么，再只修改和本课规则相关的部分。不要把期望输出直接写成常量。"
    },
    "ts-strings": {
      "title": "字符串",
      "concept": "字符串提供 length 和遍历能力。 在TypeScript中学习字符串时，先分清示例中哪一行创建值，哪个表达式读取它，哪一行把结果送到输出。修改起始代码前，先写下当前代码会输出什么。",
      "worked_example": "这个讲解示例用来定位TypeScript里字符串规则出现的位置。按顺序观察创建值的行、读取值的表达式，以及产生输出的语句。",
      "common_mistakes": [
        "只复制示例形状，却说不清字符串在代码中的作用",
        "没有确认TypeScript起始代码当前输出，就直接开始修改",
        "只改括号或标点，而没有应用本课真正练习的规则"
      ],
      "self_check": [
        "示例中哪个表达式创建了最终要输出的值？",
        "如果这个值为空、缺失或类型不对，会发生什么？",
        "起始代码中哪一行和字符串规则直接相关？"
      ],
      "exercise_prompt": "完成TypeScript的字符串练习。先预测起始代码当前会输出什么，再只修改和本课规则相关的部分。不要把期望输出直接写成常量。"
    },
    "ts-control-flow": {
      "title": "控制流",
      "concept": "if 和循环控制执行流程。 在TypeScript中学习控制流时，先分清示例中哪一行创建值，哪个表达式读取它，哪一行把结果送到输出。修改起始代码前，先写下当前代码会输出什么。",
      "worked_example": "这个讲解示例用来定位TypeScript里控制流规则出现的位置。按顺序观察创建值的行、读取值的表达式，以及产生输出的语句。",
      "common_mistakes": [
        "只复制示例形状，却说不清控制流在代码中的作用",
        "没有确认TypeScript起始代码当前输出，就直接开始修改",
        "只改括号或标点，而没有应用本课真正练习的规则"
      ],
      "self_check": [
        "示例中哪个表达式创建了最终要输出的值？",
        "如果这个值为空、缺失或类型不对，会发生什么？",
        "起始代码中哪一行和控制流规则直接相关？"
      ],
      "exercise_prompt": "完成TypeScript的控制流练习。先预测起始代码当前会输出什么，再只修改和本课规则相关的部分。不要把期望输出直接写成常量。"
    },
    "ts-functions": {
      "title": "函数",
      "concept": "参数和返回类型让意图更明确。 在TypeScript中学习函数时，先分清示例中哪一行创建值，哪个表达式读取它，哪一行把结果送到输出。修改起始代码前，先写下当前代码会输出什么。",
      "worked_example": "这个讲解示例用来定位TypeScript里函数规则出现的位置。按顺序观察创建值的行、读取值的表达式，以及产生输出的语句。",
      "common_mistakes": [
        "只复制示例形状，却说不清函数在代码中的作用",
        "没有确认TypeScript起始代码当前输出，就直接开始修改",
        "只改括号或标点，而没有应用本课真正练习的规则"
      ],
      "self_check": [
        "示例中哪个表达式创建了最终要输出的值？",
        "如果这个值为空、缺失或类型不对，会发生什么？",
        "起始代码中哪一行和函数规则直接相关？"
      ],
      "exercise_prompt": "完成TypeScript的函数练习。先预测起始代码当前会输出什么，再只修改和本课规则相关的部分。不要把期望输出直接写成常量。"
    },
    "ts-input": {
      "title": "输入解析",
      "concept": "在 Node 环境中可以读取 stdin 完成小练习。 在TypeScript中学习输入解析时，先分清示例中哪一行创建值，哪个表达式读取它，哪一行把结果送到输出。修改起始代码前，先写下当前代码会输出什么。",
      "worked_example": "这个讲解示例用来定位TypeScript里输入解析规则出现的位置。按顺序观察创建值的行、读取值的表达式，以及产生输出的语句。",
      "common_mistakes": [
        "只复制示例形状，却说不清输入解析在代码中的作用",
        "没有确认TypeScript起始代码当前输出，就直接开始修改",
        "只改括号或标点，而没有应用本课真正练习的规则"
      ],
      "self_check": [
        "示例中哪个表达式创建了最终要输出的值？",
        "如果这个值为空、缺失或类型不对，会发生什么？",
        "起始代码中哪一行和输入解析规则直接相关？"
      ],
      "exercise_prompt": "完成TypeScript的输入解析练习。先预测起始代码当前会输出什么，再只修改和本课规则相关的部分。不要把期望输出直接写成常量。"
    },
    "ts-arrays-objects": {
      "title": "数组和对象",
      "concept": "数组保存有序值，对象类型描述值的形状。 在TypeScript中学习数组和对象时，先分清示例中哪一行创建值，哪个表达式读取它，哪一行把结果送到输出。修改起始代码前，先写下当前代码会输出什么。",
      "worked_example": "这个讲解示例用来定位TypeScript里数组和对象规则出现的位置。按顺序观察创建值的行、读取值的表达式，以及产生输出的语句。",
      "common_mistakes": [
        "只复制示例形状，却说不清数组和对象在代码中的作用",
        "没有确认TypeScript起始代码当前输出，就直接开始修改",
        "只改括号或标点，而没有应用本课真正练习的规则"
      ],
      "self_check": [
        "示例中哪个表达式创建了最终要输出的值？",
        "如果这个值为空、缺失或类型不对，会发生什么？",
        "起始代码中哪一行和数组和对象规则直接相关？"
      ],
      "exercise_prompt": "完成TypeScript的数组和对象练习。先预测起始代码当前会输出什么，再只修改和本课规则相关的部分。不要把期望输出直接写成常量。"
    },
    "ts-errors-async": {
      "title": "错误和异步",
      "concept": "try/catch 处理错误，async 包装 Promise 流程。 在TypeScript中学习错误和异步时，先分清示例中哪一行创建值，哪个表达式读取它，哪一行把结果送到输出。修改起始代码前，先写下当前代码会输出什么。",
      "worked_example": "这个讲解示例用来定位TypeScript里错误和异步规则出现的位置。按顺序观察创建值的行、读取值的表达式，以及产生输出的语句。",
      "common_mistakes": [
        "只复制示例形状，却说不清错误和异步在代码中的作用",
        "没有确认TypeScript起始代码当前输出，就直接开始修改",
        "只改括号或标点，而没有应用本课真正练习的规则"
      ],
      "self_check": [
        "示例中哪个表达式创建了最终要输出的值？",
        "如果这个值为空、缺失或类型不对，会发生什么？",
        "起始代码中哪一行和错误和异步规则直接相关？"
      ],
      "exercise_prompt": "完成TypeScript的错误和异步练习。先预测起始代码当前会输出什么，再只修改和本课规则相关的部分。不要把期望输出直接写成常量。"
    },
    "ts-narrowing": {
      "title": "类型收窄",
      "concept": "类型守卫把 union 值收窄为更具体的类型。 在TypeScript中学习类型收窄时，先分清示例中哪一行创建值，哪个表达式读取它，哪一行把结果送到输出。修改起始代码前，先写下当前代码会输出什么。",
      "worked_example": "这个讲解示例用来定位TypeScript里类型收窄规则出现的位置。按顺序观察创建值的行、读取值的表达式，以及产生输出的语句。",
      "common_mistakes": [
        "只复制示例形状，却说不清类型收窄在代码中的作用",
        "没有确认TypeScript起始代码当前输出，就直接开始修改",
        "只改括号或标点，而没有应用本课真正练习的规则"
      ],
      "self_check": [
        "示例中哪个表达式创建了最终要输出的值？",
        "如果这个值为空、缺失或类型不对，会发生什么？",
        "起始代码中哪一行和类型收窄规则直接相关？"
      ],
      "exercise_prompt": "完成TypeScript的类型收窄练习。先预测起始代码当前会输出什么，再只修改和本课规则相关的部分。不要把期望输出直接写成常量。"
    },
    "ts-generics": {
      "title": "泛型",
      "concept": "泛型让可复用代码保留类型信息。 在TypeScript中学习泛型时，先分清示例中哪一行创建值，哪个表达式读取它，哪一行把结果送到输出。修改起始代码前，先写下当前代码会输出什么。",
      "worked_example": "这个讲解示例用来定位TypeScript里泛型规则出现的位置。按顺序观察创建值的行、读取值的表达式，以及产生输出的语句。",
      "common_mistakes": [
        "只复制示例形状，却说不清泛型在代码中的作用",
        "没有确认TypeScript起始代码当前输出，就直接开始修改",
        "只改括号或标点，而没有应用本课真正练习的规则"
      ],
      "self_check": [
        "示例中哪个表达式创建了最终要输出的值？",
        "如果这个值为空、缺失或类型不对，会发生什么？",
        "起始代码中哪一行和泛型规则直接相关？"
      ],
      "exercise_prompt": "完成TypeScript的泛型练习。先预测起始代码当前会输出什么，再只修改和本课规则相关的部分。不要把期望输出直接写成常量。"
    },
    "ts-mapped": {
      "title": "映射类型",
      "concept": "映射类型按规则转换对象属性。 在TypeScript中学习映射类型时，先分清示例中哪一行创建值，哪个表达式读取它，哪一行把结果送到输出。修改起始代码前，先写下当前代码会输出什么。",
      "worked_example": "这个讲解示例用来定位TypeScript里映射类型规则出现的位置。按顺序观察创建值的行、读取值的表达式，以及产生输出的语句。",
      "common_mistakes": [
        "只复制示例形状，却说不清映射类型在代码中的作用",
        "没有确认TypeScript起始代码当前输出，就直接开始修改",
        "只改括号或标点，而没有应用本课真正练习的规则"
      ],
      "self_check": [
        "示例中哪个表达式创建了最终要输出的值？",
        "如果这个值为空、缺失或类型不对，会发生什么？",
        "起始代码中哪一行和映射类型规则直接相关？"
      ],
      "exercise_prompt": "完成TypeScript的映射类型练习。先预测起始代码当前会输出什么，再只修改和本课规则相关的部分。不要把期望输出直接写成常量。"
    },
    "ts-conditional": {
      "title": "条件类型",
      "concept": "条件类型根据另一个类型选择类型。 在TypeScript中学习条件类型时，先分清示例中哪一行创建值，哪个表达式读取它，哪一行把结果送到输出。修改起始代码前，先写下当前代码会输出什么。",
      "worked_example": "这个讲解示例用来定位TypeScript里条件类型规则出现的位置。按顺序观察创建值的行、读取值的表达式，以及产生输出的语句。",
      "common_mistakes": [
        "只复制示例形状，却说不清条件类型在代码中的作用",
        "没有确认TypeScript起始代码当前输出，就直接开始修改",
        "只改括号或标点，而没有应用本课真正练习的规则"
      ],
      "self_check": [
        "示例中哪个表达式创建了最终要输出的值？",
        "如果这个值为空、缺失或类型不对，会发生什么？",
        "起始代码中哪一行和条件类型规则直接相关？"
      ],
      "exercise_prompt": "完成TypeScript的条件类型练习。先预测起始代码当前会输出什么，再只修改和本课规则相关的部分。不要把期望输出直接写成常量。"
    }
  }
}
