{
  "schema_version": 1,
  "programming_language": "rust",
  "ui_language": "ko",
  "lessons": {
    "rust-output": {
      "title": "출력",
      "concept": "println! Rust에서 출력을 익힐 때는 예제의 어느 줄이 값을 만들고 어느 줄이 그 값을 출력으로 연결하는지 표시해 보세요. 시작 코드를 고치기 전에는 현재 코드가 무엇을 출력할지 먼저 적어야 합니다.",
      "worked_example": "이 풀이 예제는 Rust의 출력 규칙이 실제 코드에서 어디에 놓이는지 보여줍니다. 값이 준비되는 줄, 그 값을 읽는 표현식, 출력으로 이어지는 줄을 분리해서 읽어 보세요.",
      "common_mistakes": [
        "출력의 역할을 보지 않고 예제 모양만 복사하는 것",
        "Rust 시작 코드의 현재 출력을 확인하지 않고 바로 수정하는 것",
        "이번 단원이 연습하는 규칙보다 괄호나 철자만 먼저 고치는 것"
      ],
      "self_check": [
        "예제에서 출력될 값을 만드는 표현식은 어디인가요?",
        "그 값이 비어 있거나 타입이 다르면 어떤 결과가 나올까요?",
        "시작 코드에서 출력 규칙과 직접 연결된 한 줄은 무엇인가요?"
      ],
      "exercise_prompt": "Rust의 출력 실습을 완성하세요. 시작 코드의 현재 출력을 먼저 예측한 뒤, 이 단원의 규칙과 연결된 부분만 수정하세요. 기대 출력을 상수로 붙여 넣지 마세요."
    },
    "rust-variables": {
      "title": "변수",
      "concept": "let은 값을 바인딩하고 mut은 변경 가능성을 허용합니다. Rust에서 변수을 익힐 때는 예제의 어느 줄이 값을 만들고 어느 줄이 그 값을 출력으로 연결하는지 표시해 보세요. 시작 코드를 고치기 전에는 현재 코드가 무엇을 출력할지 먼저 적어야 합니다.",
      "worked_example": "이 풀이 예제는 Rust의 변수 규칙이 실제 코드에서 어디에 놓이는지 보여줍니다. 값이 준비되는 줄, 그 값을 읽는 표현식, 출력으로 이어지는 줄을 분리해서 읽어 보세요.",
      "common_mistakes": [
        "변수의 역할을 보지 않고 예제 모양만 복사하는 것",
        "Rust 시작 코드의 현재 출력을 확인하지 않고 바로 수정하는 것",
        "이번 단원이 연습하는 규칙보다 괄호나 철자만 먼저 고치는 것"
      ],
      "self_check": [
        "예제에서 출력될 값을 만드는 표현식은 어디인가요?",
        "그 값이 비어 있거나 타입이 다르면 어떤 결과가 나올까요?",
        "시작 코드에서 변수 규칙과 직접 연결된 한 줄은 무엇인가요?"
      ],
      "exercise_prompt": "Rust의 변수 실습을 완성하세요. 시작 코드의 현재 출력을 먼저 예측한 뒤, 이 단원의 규칙과 연결된 부분만 수정하세요. 기대 출력을 상수로 붙여 넣지 마세요."
    },
    "rust-strings": {
      "title": "문자열",
      "concept": "String은 텍스트를 소유하고 &str은 텍스트를 빌립니다. Rust에서 문자열을 익힐 때는 예제의 어느 줄이 값을 만들고 어느 줄이 그 값을 출력으로 연결하는지 표시해 보세요. 시작 코드를 고치기 전에는 현재 코드가 무엇을 출력할지 먼저 적어야 합니다.",
      "worked_example": "이 풀이 예제는 Rust의 문자열 규칙이 실제 코드에서 어디에 놓이는지 보여줍니다. 값이 준비되는 줄, 그 값을 읽는 표현식, 출력으로 이어지는 줄을 분리해서 읽어 보세요.",
      "common_mistakes": [
        "문자열의 역할을 보지 않고 예제 모양만 복사하는 것",
        "Rust 시작 코드의 현재 출력을 확인하지 않고 바로 수정하는 것",
        "이번 단원이 연습하는 규칙보다 괄호나 철자만 먼저 고치는 것"
      ],
      "self_check": [
        "예제에서 출력될 값을 만드는 표현식은 어디인가요?",
        "그 값이 비어 있거나 타입이 다르면 어떤 결과가 나올까요?",
        "시작 코드에서 문자열 규칙과 직접 연결된 한 줄은 무엇인가요?"
      ],
      "exercise_prompt": "Rust의 문자열 실습을 완성하세요. 시작 코드의 현재 출력을 먼저 예측한 뒤, 이 단원의 규칙과 연결된 부분만 수정하세요. 기대 출력을 상수로 붙여 넣지 마세요."
    },
    "rust-control-flow": {
      "title": "제어 흐름",
      "concept": "if는 표현식이고 for는 범위와 컬렉션을 반복합니다. Rust에서 제어 흐름을 익힐 때는 예제의 어느 줄이 값을 만들고 어느 줄이 그 값을 출력으로 연결하는지 표시해 보세요. 시작 코드를 고치기 전에는 현재 코드가 무엇을 출력할지 먼저 적어야 합니다.",
      "worked_example": "이 풀이 예제는 Rust의 제어 흐름 규칙이 실제 코드에서 어디에 놓이는지 보여줍니다. 값이 준비되는 줄, 그 값을 읽는 표현식, 출력으로 이어지는 줄을 분리해서 읽어 보세요.",
      "common_mistakes": [
        "제어 흐름의 역할을 보지 않고 예제 모양만 복사하는 것",
        "Rust 시작 코드의 현재 출력을 확인하지 않고 바로 수정하는 것",
        "이번 단원이 연습하는 규칙보다 괄호나 철자만 먼저 고치는 것"
      ],
      "self_check": [
        "예제에서 출력될 값을 만드는 표현식은 어디인가요?",
        "그 값이 비어 있거나 타입이 다르면 어떤 결과가 나올까요?",
        "시작 코드에서 제어 흐름 규칙과 직접 연결된 한 줄은 무엇인가요?"
      ],
      "exercise_prompt": "Rust의 제어 흐름 실습을 완성하세요. 시작 코드의 현재 출력을 먼저 예측한 뒤, 이 단원의 규칙과 연결된 부분만 수정하세요. 기대 출력을 상수로 붙여 넣지 마세요."
    },
    "rust-functions": {
      "title": "함수",
      "concept": "함수는 매개변수와 반환 타입을 선언합니다. Rust에서 함수을 익힐 때는 예제의 어느 줄이 값을 만들고 어느 줄이 그 값을 출력으로 연결하는지 표시해 보세요. 시작 코드를 고치기 전에는 현재 코드가 무엇을 출력할지 먼저 적어야 합니다.",
      "worked_example": "이 풀이 예제는 Rust의 함수 규칙이 실제 코드에서 어디에 놓이는지 보여줍니다. 값이 준비되는 줄, 그 값을 읽는 표현식, 출력으로 이어지는 줄을 분리해서 읽어 보세요.",
      "common_mistakes": [
        "함수의 역할을 보지 않고 예제 모양만 복사하는 것",
        "Rust 시작 코드의 현재 출력을 확인하지 않고 바로 수정하는 것",
        "이번 단원이 연습하는 규칙보다 괄호나 철자만 먼저 고치는 것"
      ],
      "self_check": [
        "예제에서 출력될 값을 만드는 표현식은 어디인가요?",
        "그 값이 비어 있거나 타입이 다르면 어떤 결과가 나올까요?",
        "시작 코드에서 함수 규칙과 직접 연결된 한 줄은 무엇인가요?"
      ],
      "exercise_prompt": "Rust의 함수 실습을 완성하세요. 시작 코드의 현재 출력을 먼저 예측한 뒤, 이 단원의 규칙과 연결된 부분만 수정하세요. 기대 출력을 상수로 붙여 넣지 마세요."
    },
    "rust-input": {
      "title": "입력 파싱",
      "concept": "stdin을 String으로 읽은 뒤 split하거나 그대로 출력합니다. Rust에서 입력 파싱을 익힐 때는 예제의 어느 줄이 값을 만들고 어느 줄이 그 값을 출력으로 연결하는지 표시해 보세요. 시작 코드를 고치기 전에는 현재 코드가 무엇을 출력할지 먼저 적어야 합니다.",
      "worked_example": "이 풀이 예제는 Rust의 입력 파싱 규칙이 실제 코드에서 어디에 놓이는지 보여줍니다. 값이 준비되는 줄, 그 값을 읽는 표현식, 출력으로 이어지는 줄을 분리해서 읽어 보세요.",
      "common_mistakes": [
        "입력 파싱의 역할을 보지 않고 예제 모양만 복사하는 것",
        "Rust 시작 코드의 현재 출력을 확인하지 않고 바로 수정하는 것",
        "이번 단원이 연습하는 규칙보다 괄호나 철자만 먼저 고치는 것"
      ],
      "self_check": [
        "예제에서 출력될 값을 만드는 표현식은 어디인가요?",
        "그 값이 비어 있거나 타입이 다르면 어떤 결과가 나올까요?",
        "시작 코드에서 입력 파싱 규칙과 직접 연결된 한 줄은 무엇인가요?"
      ],
      "exercise_prompt": "Rust의 입력 파싱 실습을 완성하세요. 시작 코드의 현재 출력을 먼저 예측한 뒤, 이 단원의 규칙과 연결된 부분만 수정하세요. 기대 출력을 상수로 붙여 넣지 마세요."
    },
    "rust-vec-hashmap": {
      "title": "Vec과 HashMap",
      "concept": "Vec은 순서를 가진 값을 저장하고 HashMap은 키와 값을 저장합니다. Rust에서 Vec과 HashMap을 익힐 때는 예제의 어느 줄이 값을 만들고 어느 줄이 그 값을 출력으로 연결하는지 표시해 보세요. 시작 코드를 고치기 전에는 현재 코드가 무엇을 출력할지 먼저 적어야 합니다.",
      "worked_example": "이 풀이 예제는 Rust의 Vec과 HashMap 규칙이 실제 코드에서 어디에 놓이는지 보여줍니다. 값이 준비되는 줄, 그 값을 읽는 표현식, 출력으로 이어지는 줄을 분리해서 읽어 보세요.",
      "common_mistakes": [
        "Vec과 HashMap의 역할을 보지 않고 예제 모양만 복사하는 것",
        "Rust 시작 코드의 현재 출력을 확인하지 않고 바로 수정하는 것",
        "이번 단원이 연습하는 규칙보다 괄호나 철자만 먼저 고치는 것"
      ],
      "self_check": [
        "예제에서 출력될 값을 만드는 표현식은 어디인가요?",
        "그 값이 비어 있거나 타입이 다르면 어떤 결과가 나올까요?",
        "시작 코드에서 Vec과 HashMap 규칙과 직접 연결된 한 줄은 무엇인가요?"
      ],
      "exercise_prompt": "Rust의 Vec과 HashMap 실습을 완성하세요. 시작 코드의 현재 출력을 먼저 예측한 뒤, 이 단원의 규칙과 연결된 부분만 수정하세요. 기대 출력을 상수로 붙여 넣지 마세요."
    },
    "rust-result": {
      "title": "Result와 ?",
      "concept": "Result는 복구 가능한 오류를 표현하고 ?는 Err에서 일찍 반환합니다. Rust에서 Result와 ?을 익힐 때는 예제의 어느 줄이 값을 만들고 어느 줄이 그 값을 출력으로 연결하는지 표시해 보세요. 시작 코드를 고치기 전에는 현재 코드가 무엇을 출력할지 먼저 적어야 합니다.",
      "worked_example": "이 풀이 예제는 Rust의 Result와 ? 규칙이 실제 코드에서 어디에 놓이는지 보여줍니다. 값이 준비되는 줄, 그 값을 읽는 표현식, 출력으로 이어지는 줄을 분리해서 읽어 보세요.",
      "common_mistakes": [
        "Result와 ?의 역할을 보지 않고 예제 모양만 복사하는 것",
        "Rust 시작 코드의 현재 출력을 확인하지 않고 바로 수정하는 것",
        "이번 단원이 연습하는 규칙보다 괄호나 철자만 먼저 고치는 것"
      ],
      "self_check": [
        "예제에서 출력될 값을 만드는 표현식은 어디인가요?",
        "그 값이 비어 있거나 타입이 다르면 어떤 결과가 나올까요?",
        "시작 코드에서 Result와 ? 규칙과 직접 연결된 한 줄은 무엇인가요?"
      ],
      "exercise_prompt": "Rust의 Result와 ? 실습을 완성하세요. 시작 코드의 현재 출력을 먼저 예측한 뒤, 이 단원의 규칙과 연결된 부분만 수정하세요. 기대 출력을 상수로 붙여 넣지 마세요."
    },
    "rust-ownership": {
      "title": "소유권과 빌림",
      "concept": "값은 하나의 소유자를 가지며 참조는 이동 없이 값을 빌립니다. Rust에서 소유권과 빌림을 익힐 때는 예제의 어느 줄이 값을 만들고 어느 줄이 그 값을 출력으로 연결하는지 표시해 보세요. 시작 코드를 고치기 전에는 현재 코드가 무엇을 출력할지 먼저 적어야 합니다.",
      "worked_example": "이 풀이 예제는 Rust의 소유권과 빌림 규칙이 실제 코드에서 어디에 놓이는지 보여줍니다. 값이 준비되는 줄, 그 값을 읽는 표현식, 출력으로 이어지는 줄을 분리해서 읽어 보세요.",
      "common_mistakes": [
        "소유권과 빌림의 역할을 보지 않고 예제 모양만 복사하는 것",
        "Rust 시작 코드의 현재 출력을 확인하지 않고 바로 수정하는 것",
        "이번 단원이 연습하는 규칙보다 괄호나 철자만 먼저 고치는 것"
      ],
      "self_check": [
        "예제에서 출력될 값을 만드는 표현식은 어디인가요?",
        "그 값이 비어 있거나 타입이 다르면 어떤 결과가 나올까요?",
        "시작 코드에서 소유권과 빌림 규칙과 직접 연결된 한 줄은 무엇인가요?"
      ],
      "exercise_prompt": "Rust의 소유권과 빌림 실습을 완성하세요. 시작 코드의 현재 출력을 먼저 예측한 뒤, 이 단원의 규칙과 연결된 부분만 수정하세요. 기대 출력을 상수로 붙여 넣지 마세요."
    },
    "rust-enum-match": {
      "title": "열거형과 match",
      "concept": "enum은 대안을 모델링하고 match는 모든 경우를 빠짐없이 처리합니다. Rust에서 열거형과 match을 익힐 때는 예제의 어느 줄이 값을 만들고 어느 줄이 그 값을 출력으로 연결하는지 표시해 보세요. 시작 코드를 고치기 전에는 현재 코드가 무엇을 출력할지 먼저 적어야 합니다.",
      "worked_example": "이 풀이 예제는 Rust의 열거형과 match 규칙이 실제 코드에서 어디에 놓이는지 보여줍니다. 값이 준비되는 줄, 그 값을 읽는 표현식, 출력으로 이어지는 줄을 분리해서 읽어 보세요.",
      "common_mistakes": [
        "열거형과 match의 역할을 보지 않고 예제 모양만 복사하는 것",
        "Rust 시작 코드의 현재 출력을 확인하지 않고 바로 수정하는 것",
        "이번 단원이 연습하는 규칙보다 괄호나 철자만 먼저 고치는 것"
      ],
      "self_check": [
        "예제에서 출력될 값을 만드는 표현식은 어디인가요?",
        "그 값이 비어 있거나 타입이 다르면 어떤 결과가 나올까요?",
        "시작 코드에서 열거형과 match 규칙과 직접 연결된 한 줄은 무엇인가요?"
      ],
      "exercise_prompt": "Rust의 열거형과 match 실습을 완성하세요. 시작 코드의 현재 출력을 먼저 예측한 뒤, 이 단원의 규칙과 연결된 부분만 수정하세요. 기대 출력을 상수로 붙여 넣지 마세요."
    },
    "rust-traits-lifetimes": {
      "title": "트레이트, 제네릭, 라이프타임",
      "concept": "트레이트는 공통 동작을 정의하고 라이프타임은 빌린 값의 관계를 설명합니다. Rust에서 트레이트, 제네릭, 라이프타임을 익힐 때는 예제의 어느 줄이 값을 만들고 어느 줄이 그 값을 출력으로 연결하는지 표시해 보세요. 시작 코드를 고치기 전에는 현재 코드가 무엇을 출력할지 먼저 적어야 합니다.",
      "worked_example": "이 풀이 예제는 Rust의 트레이트, 제네릭, 라이프타임 규칙이 실제 코드에서 어디에 놓이는지 보여줍니다. 값이 준비되는 줄, 그 값을 읽는 표현식, 출력으로 이어지는 줄을 분리해서 읽어 보세요.",
      "common_mistakes": [
        "트레이트, 제네릭, 라이프타임의 역할을 보지 않고 예제 모양만 복사하는 것",
        "Rust 시작 코드의 현재 출력을 확인하지 않고 바로 수정하는 것",
        "이번 단원이 연습하는 규칙보다 괄호나 철자만 먼저 고치는 것"
      ],
      "self_check": [
        "예제에서 출력될 값을 만드는 표현식은 어디인가요?",
        "그 값이 비어 있거나 타입이 다르면 어떤 결과가 나올까요?",
        "시작 코드에서 트레이트, 제네릭, 라이프타임 규칙과 직접 연결된 한 줄은 무엇인가요?"
      ],
      "exercise_prompt": "Rust의 트레이트, 제네릭, 라이프타임 실습을 완성하세요. 시작 코드의 현재 출력을 먼저 예측한 뒤, 이 단원의 규칙과 연결된 부분만 수정하세요. 기대 출력을 상수로 붙여 넣지 마세요."
    },
    "rust-iterators": {
      "title": "이터레이터와 클로저",
      "concept": "이터레이터는 지연 변환을 조합합니다. Rust에서 이터레이터와 클로저을 익힐 때는 예제의 어느 줄이 값을 만들고 어느 줄이 그 값을 출력으로 연결하는지 표시해 보세요. 시작 코드를 고치기 전에는 현재 코드가 무엇을 출력할지 먼저 적어야 합니다.",
      "worked_example": "이 풀이 예제는 Rust의 이터레이터와 클로저 규칙이 실제 코드에서 어디에 놓이는지 보여줍니다. 값이 준비되는 줄, 그 값을 읽는 표현식, 출력으로 이어지는 줄을 분리해서 읽어 보세요.",
      "common_mistakes": [
        "이터레이터와 클로저의 역할을 보지 않고 예제 모양만 복사하는 것",
        "Rust 시작 코드의 현재 출력을 확인하지 않고 바로 수정하는 것",
        "이번 단원이 연습하는 규칙보다 괄호나 철자만 먼저 고치는 것"
      ],
      "self_check": [
        "예제에서 출력될 값을 만드는 표현식은 어디인가요?",
        "그 값이 비어 있거나 타입이 다르면 어떤 결과가 나올까요?",
        "시작 코드에서 이터레이터와 클로저 규칙과 직접 연결된 한 줄은 무엇인가요?"
      ],
      "exercise_prompt": "Rust의 이터레이터와 클로저 실습을 완성하세요. 시작 코드의 현재 출력을 먼저 예측한 뒤, 이 단원의 규칙과 연결된 부분만 수정하세요. 기대 출력을 상수로 붙여 넣지 마세요."
    }
  }
}
