{
  "schema_version": 1,
  "programming_language": "python",
  "ui_language": "ja",
  "lessons": {
    "py-output": {
      "title": "出力",
      "concept": "printで値を1行として画面に出力します。 Pythonで出力を学ぶときは、例のどの行が値を用意し、どの式がそれを読み取り、どの行が出力につながるのかを分けて確認します。スターターコードを直す前に、今の出力を先に予想してください。",
      "worked_example": "この解説例では、Pythonの出力の規則が実際のコードのどこに現れるかを確認します。値を作る行、値を読む式、出力する行を順に追ってください。",
      "common_mistakes": [
        "出力の役割を説明せず、例の形だけを写してしまうこと",
        "Pythonのスターターコードが今何を出力するか確認せずに編集すること",
        "このレッスンの規則よりも、括弧や記号の修正だけに注意が向くこと"
      ],
      "self_check": [
        "例の中で、出力される値を作っている式はどこですか。",
        "その値が空、欠けている、または型違いなら何が起きますか。",
        "スターターコードのどの一行が出力の規則に直接関係していますか。"
      ],
      "exercise_prompt": "Pythonの出力の実習を完成させてください。まずスターターコードの現在の出力を予想し、このレッスンの規則に関係する部分だけを編集します。期待出力をそのまま定数にしないでください。"
    },
    "py-variables": {
      "title": "変数",
      "concept": "名前は値を指し、あとから別の値に結び直せます。 Pythonで変数を学ぶときは、例のどの行が値を用意し、どの式がそれを読み取り、どの行が出力につながるのかを分けて確認します。スターターコードを直す前に、今の出力を先に予想してください。",
      "worked_example": "この解説例では、Pythonの変数の規則が実際のコードのどこに現れるかを確認します。値を作る行、値を読む式、出力する行を順に追ってください。",
      "common_mistakes": [
        "変数の役割を説明せず、例の形だけを写してしまうこと",
        "Pythonのスターターコードが今何を出力するか確認せずに編集すること",
        "このレッスンの規則よりも、括弧や記号の修正だけに注意が向くこと"
      ],
      "self_check": [
        "例の中で、出力される値を作っている式はどこですか。",
        "その値が空、欠けている、または型違いなら何が起きますか。",
        "スターターコードのどの一行が変数の規則に直接関係していますか。"
      ],
      "exercise_prompt": "Pythonの変数の実習を完成させてください。まずスターターコードの現在の出力を予想し、このレッスンの規則に関係する部分だけを編集します。期待出力をそのまま定数にしないでください。"
    },
    "py-strings": {
      "title": "文字列",
      "concept": "文字列は長さ、インデックス、スライス、反復を扱えます。 Pythonで文字列を学ぶときは、例のどの行が値を用意し、どの式がそれを読み取り、どの行が出力につながるのかを分けて確認します。スターターコードを直す前に、今の出力を先に予想してください。",
      "worked_example": "この解説例では、Pythonの文字列の規則が実際のコードのどこに現れるかを確認します。値を作る行、値を読む式、出力する行を順に追ってください。",
      "common_mistakes": [
        "文字列の役割を説明せず、例の形だけを写してしまうこと",
        "Pythonのスターターコードが今何を出力するか確認せずに編集すること",
        "このレッスンの規則よりも、括弧や記号の修正だけに注意が向くこと"
      ],
      "self_check": [
        "例の中で、出力される値を作っている式はどこですか。",
        "その値が空、欠けている、または型違いなら何が起きますか。",
        "スターターコードのどの一行が文字列の規則に直接関係していますか。"
      ],
      "exercise_prompt": "Pythonの文字列の実習を完成させてください。まずスターターコードの現在の出力を予想し、このレッスンの規則に関係する部分だけを編集します。期待出力をそのまま定数にしないでください。"
    },
    "py-control-flow": {
      "title": "制御フロー",
      "concept": "if、for、whileで分岐と繰り返しを表します。 Pythonで制御フローを学ぶときは、例のどの行が値を用意し、どの式がそれを読み取り、どの行が出力につながるのかを分けて確認します。スターターコードを直す前に、今の出力を先に予想してください。",
      "worked_example": "この解説例では、Pythonの制御フローの規則が実際のコードのどこに現れるかを確認します。値を作る行、値を読む式、出力する行を順に追ってください。",
      "common_mistakes": [
        "制御フローの役割を説明せず、例の形だけを写してしまうこと",
        "Pythonのスターターコードが今何を出力するか確認せずに編集すること",
        "このレッスンの規則よりも、括弧や記号の修正だけに注意が向くこと"
      ],
      "self_check": [
        "例の中で、出力される値を作っている式はどこですか。",
        "その値が空、欠けている、または型違いなら何が起きますか。",
        "スターターコードのどの一行が制御フローの規則に直接関係していますか。"
      ],
      "exercise_prompt": "Pythonの制御フローの実習を完成させてください。まずスターターコードの現在の出力を予想し、このレッスンの規則に関係する部分だけを編集します。期待出力をそのまま定数にしないでください。"
    },
    "py-functions": {
      "title": "関数",
      "concept": "defで引数と戻り値を持つ再利用可能な処理を作ります。 Pythonで関数を学ぶときは、例のどの行が値を用意し、どの式がそれを読み取り、どの行が出力につながるのかを分けて確認します。スターターコードを直す前に、今の出力を先に予想してください。",
      "worked_example": "この解説例では、Pythonの関数の規則が実際のコードのどこに現れるかを確認します。値を作る行、値を読む式、出力する行を順に追ってください。",
      "common_mistakes": [
        "関数の役割を説明せず、例の形だけを写してしまうこと",
        "Pythonのスターターコードが今何を出力するか確認せずに編集すること",
        "このレッスンの規則よりも、括弧や記号の修正だけに注意が向くこと"
      ],
      "self_check": [
        "例の中で、出力される値を作っている式はどこですか。",
        "その値が空、欠けている、または型違いなら何が起きますか。",
        "スターターコードのどの一行が関数の規則に直接関係していますか。"
      ],
      "exercise_prompt": "Pythonの関数の実習を完成させてください。まずスターターコードの現在の出力を予想し、このレッスンの規則に関係する部分だけを編集します。期待出力をそのまま定数にしないでください。"
    },
    "py-input": {
      "title": "入力解析",
      "concept": "sys.stdinとsplitで競技プログラミング形式の入力を処理します。 Pythonで入力解析を学ぶときは、例のどの行が値を用意し、どの式がそれを読み取り、どの行が出力につながるのかを分けて確認します。スターターコードを直す前に、今の出力を先に予想してください。",
      "worked_example": "この解説例では、Pythonの入力解析の規則が実際のコードのどこに現れるかを確認します。値を作る行、値を読む式、出力する行を順に追ってください。",
      "common_mistakes": [
        "入力解析の役割を説明せず、例の形だけを写してしまうこと",
        "Pythonのスターターコードが今何を出力するか確認せずに編集すること",
        "このレッスンの規則よりも、括弧や記号の修正だけに注意が向くこと"
      ],
      "self_check": [
        "例の中で、出力される値を作っている式はどこですか。",
        "その値が空、欠けている、または型違いなら何が起きますか。",
        "スターターコードのどの一行が入力解析の規則に直接関係していますか。"
      ],
      "exercise_prompt": "Pythonの入力解析の実習を完成させてください。まずスターターコードの現在の出力を予想し、このレッスンの規則に関係する部分だけを編集します。期待出力をそのまま定数にしないでください。"
    },
    "py-lists-dicts": {
      "title": "リストと辞書",
      "concept": "リストは順序を保ち、辞書はキーを値に対応づけます。 Pythonでリストと辞書を学ぶときは、例のどの行が値を用意し、どの式がそれを読み取り、どの行が出力につながるのかを分けて確認します。スターターコードを直す前に、今の出力を先に予想してください。",
      "worked_example": "この解説例では、Pythonのリストと辞書の規則が実際のコードのどこに現れるかを確認します。値を作る行、値を読む式、出力する行を順に追ってください。",
      "common_mistakes": [
        "リストと辞書の役割を説明せず、例の形だけを写してしまうこと",
        "Pythonのスターターコードが今何を出力するか確認せずに編集すること",
        "このレッスンの規則よりも、括弧や記号の修正だけに注意が向くこと"
      ],
      "self_check": [
        "例の中で、出力される値を作っている式はどこですか。",
        "その値が空、欠けている、または型違いなら何が起きますか。",
        "スターターコードのどの一行がリストと辞書の規則に直接関係していますか。"
      ],
      "exercise_prompt": "Pythonのリストと辞書の実習を完成させてください。まずスターターコードの現在の出力を予想し、このレッスンの規則に関係する部分だけを編集します。期待出力をそのまま定数にしないでください。"
    },
    "py-errors": {
      "title": "例外",
      "concept": "tryとexceptで回復可能な失敗を処理します。 Pythonで例外を学ぶときは、例のどの行が値を用意し、どの式がそれを読み取り、どの行が出力につながるのかを分けて確認します。スターターコードを直す前に、今の出力を先に予想してください。",
      "worked_example": "この解説例では、Pythonの例外の規則が実際のコードのどこに現れるかを確認します。値を作る行、値を読む式、出力する行を順に追ってください。",
      "common_mistakes": [
        "例外の役割を説明せず、例の形だけを写してしまうこと",
        "Pythonのスターターコードが今何を出力するか確認せずに編集すること",
        "このレッスンの規則よりも、括弧や記号の修正だけに注意が向くこと"
      ],
      "self_check": [
        "例の中で、出力される値を作っている式はどこですか。",
        "その値が空、欠けている、または型違いなら何が起きますか。",
        "スターターコードのどの一行が例外の規則に直接関係していますか。"
      ],
      "exercise_prompt": "Pythonの例外の実習を完成させてください。まずスターターコードの現在の出力を予想し、このレッスンの規則に関係する部分だけを編集します。期待出力をそのまま定数にしないでください。"
    },
    "py-comprehensions": {
      "title": "内包表記",
      "concept": "内包表記は式からコレクションを簡潔に作ります。 Pythonで内包表記を学ぶときは、例のどの行が値を用意し、どの式がそれを読み取り、どの行が出力につながるのかを分けて確認します。スターターコードを直す前に、今の出力を先に予想してください。",
      "worked_example": "この解説例では、Pythonの内包表記の規則が実際のコードのどこに現れるかを確認します。値を作る行、値を読む式、出力する行を順に追ってください。",
      "common_mistakes": [
        "内包表記の役割を説明せず、例の形だけを写してしまうこと",
        "Pythonのスターターコードが今何を出力するか確認せずに編集すること",
        "このレッスンの規則よりも、括弧や記号の修正だけに注意が向くこと"
      ],
      "self_check": [
        "例の中で、出力される値を作っている式はどこですか。",
        "その値が空、欠けている、または型違いなら何が起きますか。",
        "スターターコードのどの一行が内包表記の規則に直接関係していますか。"
      ],
      "exercise_prompt": "Pythonの内包表記の実習を完成させてください。まずスターターコードの現在の出力を予想し、このレッスンの規則に関係する部分だけを編集します。期待出力をそのまま定数にしないでください。"
    },
    "py-generators": {
      "title": "イテレータとジェネレータ",
      "concept": "yieldで必要なときに値を生成するシーケンスを作ります。 Pythonでイテレータとジェネレータを学ぶときは、例のどの行が値を用意し、どの式がそれを読み取り、どの行が出力につながるのかを分けて確認します。スターターコードを直す前に、今の出力を先に予想してください。",
      "worked_example": "この解説例では、Pythonのイテレータとジェネレータの規則が実際のコードのどこに現れるかを確認します。値を作る行、値を読む式、出力する行を順に追ってください。",
      "common_mistakes": [
        "イテレータとジェネレータの役割を説明せず、例の形だけを写してしまうこと",
        "Pythonのスターターコードが今何を出力するか確認せずに編集すること",
        "このレッスンの規則よりも、括弧や記号の修正だけに注意が向くこと"
      ],
      "self_check": [
        "例の中で、出力される値を作っている式はどこですか。",
        "その値が空、欠けている、または型違いなら何が起きますか。",
        "スターターコードのどの一行がイテレータとジェネレータの規則に直接関係していますか。"
      ],
      "exercise_prompt": "Pythonのイテレータとジェネレータの実習を完成させてください。まずスターターコードの現在の出力を予想し、このレッスンの規則に関係する部分だけを編集します。期待出力をそのまま定数にしないでください。"
    },
    "py-decorators": {
      "title": "デコレータ",
      "concept": "デコレータは関数定義時に関数を包んで振る舞いを拡張します。 Pythonでデコレータを学ぶときは、例のどの行が値を用意し、どの式がそれを読み取り、どの行が出力につながるのかを分けて確認します。スターターコードを直す前に、今の出力を先に予想してください。",
      "worked_example": "この解説例では、Pythonのデコレータの規則が実際のコードのどこに現れるかを確認します。値を作る行、値を読む式、出力する行を順に追ってください。",
      "common_mistakes": [
        "デコレータの役割を説明せず、例の形だけを写してしまうこと",
        "Pythonのスターターコードが今何を出力するか確認せずに編集すること",
        "このレッスンの規則よりも、括弧や記号の修正だけに注意が向くこと"
      ],
      "self_check": [
        "例の中で、出力される値を作っている式はどこですか。",
        "その値が空、欠けている、または型違いなら何が起きますか。",
        "スターターコードのどの一行がデコレータの規則に直接関係していますか。"
      ],
      "exercise_prompt": "Pythonのデコレータの実習を完成させてください。まずスターターコードの現在の出力を予想し、このレッスンの規則に関係する部分だけを編集します。期待出力をそのまま定数にしないでください。"
    },
    "py-context-types": {
      "title": "コンテキストマネージャと型ヒント",
      "concept": "withはスコープ付きリソースを管理し、型ヒントは期待する型を示します。 Pythonでコンテキストマネージャと型ヒントを学ぶときは、例のどの行が値を用意し、どの式がそれを読み取り、どの行が出力につながるのかを分けて確認します。スターターコードを直す前に、今の出力を先に予想してください。",
      "worked_example": "この解説例では、Pythonのコンテキストマネージャと型ヒントの規則が実際のコードのどこに現れるかを確認します。値を作る行、値を読む式、出力する行を順に追ってください。",
      "common_mistakes": [
        "コンテキストマネージャと型ヒントの役割を説明せず、例の形だけを写してしまうこと",
        "Pythonのスターターコードが今何を出力するか確認せずに編集すること",
        "このレッスンの規則よりも、括弧や記号の修正だけに注意が向くこと"
      ],
      "self_check": [
        "例の中で、出力される値を作っている式はどこですか。",
        "その値が空、欠けている、または型違いなら何が起きますか。",
        "スターターコードのどの一行がコンテキストマネージャと型ヒントの規則に直接関係していますか。"
      ],
      "exercise_prompt": "Pythonのコンテキストマネージャと型ヒントの実習を完成させてください。まずスターターコードの現在の出力を予想し、このレッスンの規則に関係する部分だけを編集します。期待出力をそのまま定数にしないでください。"
    }
  }
}
