{
  "schema_version": 1,
  "programming_language": "rust",
  "ui_language": "zh",
  "lessons": {
    "rust-output": {
      "title": "输出",
      "concept": "println! 宏输出一行。 在Rust中学习输出时，先分清示例中哪一行创建值，哪个表达式读取它，哪一行把结果送到输出。修改起始代码前，先写下当前代码会输出什么。",
      "worked_example": "这个讲解示例用来定位Rust里输出规则出现的位置。按顺序观察创建值的行、读取值的表达式，以及产生输出的语句。",
      "common_mistakes": [
        "只复制示例形状，却说不清输出在代码中的作用",
        "没有确认Rust起始代码当前输出，就直接开始修改",
        "只改括号或标点，而没有应用本课真正练习的规则"
      ],
      "self_check": [
        "示例中哪个表达式创建了最终要输出的值？",
        "如果这个值为空、缺失或类型不对，会发生什么？",
        "起始代码中哪一行和输出规则直接相关？"
      ],
      "exercise_prompt": "完成Rust的输出练习。先预测起始代码当前会输出什么，再只修改和本课规则相关的部分。不要把期望输出直接写成常量。"
    },
    "rust-variables": {
      "title": "变量",
      "concept": "let 绑定值，mut 允许修改。 在Rust中学习变量时，先分清示例中哪一行创建值，哪个表达式读取它，哪一行把结果送到输出。修改起始代码前，先写下当前代码会输出什么。",
      "worked_example": "这个讲解示例用来定位Rust里变量规则出现的位置。按顺序观察创建值的行、读取值的表达式，以及产生输出的语句。",
      "common_mistakes": [
        "只复制示例形状，却说不清变量在代码中的作用",
        "没有确认Rust起始代码当前输出，就直接开始修改",
        "只改括号或标点，而没有应用本课真正练习的规则"
      ],
      "self_check": [
        "示例中哪个表达式创建了最终要输出的值？",
        "如果这个值为空、缺失或类型不对，会发生什么？",
        "起始代码中哪一行和变量规则直接相关？"
      ],
      "exercise_prompt": "完成Rust的变量练习。先预测起始代码当前会输出什么，再只修改和本课规则相关的部分。不要把期望输出直接写成常量。"
    },
    "rust-strings": {
      "title": "字符串",
      "concept": "String 拥有文本，&str 借用文本。 在Rust中学习字符串时，先分清示例中哪一行创建值，哪个表达式读取它，哪一行把结果送到输出。修改起始代码前，先写下当前代码会输出什么。",
      "worked_example": "这个讲解示例用来定位Rust里字符串规则出现的位置。按顺序观察创建值的行、读取值的表达式，以及产生输出的语句。",
      "common_mistakes": [
        "只复制示例形状，却说不清字符串在代码中的作用",
        "没有确认Rust起始代码当前输出，就直接开始修改",
        "只改括号或标点，而没有应用本课真正练习的规则"
      ],
      "self_check": [
        "示例中哪个表达式创建了最终要输出的值？",
        "如果这个值为空、缺失或类型不对，会发生什么？",
        "起始代码中哪一行和字符串规则直接相关？"
      ],
      "exercise_prompt": "完成Rust的字符串练习。先预测起始代码当前会输出什么，再只修改和本课规则相关的部分。不要把期望输出直接写成常量。"
    },
    "rust-control-flow": {
      "title": "控制流",
      "concept": "if 是表达式，for 遍历范围和集合。 在Rust中学习控制流时，先分清示例中哪一行创建值，哪个表达式读取它，哪一行把结果送到输出。修改起始代码前，先写下当前代码会输出什么。",
      "worked_example": "这个讲解示例用来定位Rust里控制流规则出现的位置。按顺序观察创建值的行、读取值的表达式，以及产生输出的语句。",
      "common_mistakes": [
        "只复制示例形状，却说不清控制流在代码中的作用",
        "没有确认Rust起始代码当前输出，就直接开始修改",
        "只改括号或标点，而没有应用本课真正练习的规则"
      ],
      "self_check": [
        "示例中哪个表达式创建了最终要输出的值？",
        "如果这个值为空、缺失或类型不对，会发生什么？",
        "起始代码中哪一行和控制流规则直接相关？"
      ],
      "exercise_prompt": "完成Rust的控制流练习。先预测起始代码当前会输出什么，再只修改和本课规则相关的部分。不要把期望输出直接写成常量。"
    },
    "rust-functions": {
      "title": "函数",
      "concept": "函数声明参数和返回类型。 在Rust中学习函数时，先分清示例中哪一行创建值，哪个表达式读取它，哪一行把结果送到输出。修改起始代码前，先写下当前代码会输出什么。",
      "worked_example": "这个讲解示例用来定位Rust里函数规则出现的位置。按顺序观察创建值的行、读取值的表达式，以及产生输出的语句。",
      "common_mistakes": [
        "只复制示例形状，却说不清函数在代码中的作用",
        "没有确认Rust起始代码当前输出，就直接开始修改",
        "只改括号或标点，而没有应用本课真正练习的规则"
      ],
      "self_check": [
        "示例中哪个表达式创建了最终要输出的值？",
        "如果这个值为空、缺失或类型不对，会发生什么？",
        "起始代码中哪一行和函数规则直接相关？"
      ],
      "exercise_prompt": "完成Rust的函数练习。先预测起始代码当前会输出什么，再只修改和本课规则相关的部分。不要把期望输出直接写成常量。"
    },
    "rust-input": {
      "title": "输入解析",
      "concept": "将 stdin 读入 String 后再 split 或直接输出。 在Rust中学习输入解析时，先分清示例中哪一行创建值，哪个表达式读取它，哪一行把结果送到输出。修改起始代码前，先写下当前代码会输出什么。",
      "worked_example": "这个讲解示例用来定位Rust里输入解析规则出现的位置。按顺序观察创建值的行、读取值的表达式，以及产生输出的语句。",
      "common_mistakes": [
        "只复制示例形状，却说不清输入解析在代码中的作用",
        "没有确认Rust起始代码当前输出，就直接开始修改",
        "只改括号或标点，而没有应用本课真正练习的规则"
      ],
      "self_check": [
        "示例中哪个表达式创建了最终要输出的值？",
        "如果这个值为空、缺失或类型不对，会发生什么？",
        "起始代码中哪一行和输入解析规则直接相关？"
      ],
      "exercise_prompt": "完成Rust的输入解析练习。先预测起始代码当前会输出什么，再只修改和本课规则相关的部分。不要把期望输出直接写成常量。"
    },
    "rust-vec-hashmap": {
      "title": "Vec 和 HashMap",
      "concept": "Vec 保存有顺序的值，适合按位置访问或按顺序遍历。 在Rust中学习Vec 和 HashMap时，先分清示例中哪一行创建值，哪个表达式读取它，哪一行把结果送到输出。修改起始代码前，先写下当前代码会输出什么。",
      "worked_example": "这个讲解示例用来定位Rust里Vec 和 HashMap规则出现的位置。按顺序观察创建值的行、读取值的表达式，以及产生输出的语句。",
      "common_mistakes": [
        "只复制示例形状，却说不清Vec 和 HashMap在代码中的作用",
        "没有确认Rust起始代码当前输出，就直接开始修改",
        "只改括号或标点，而没有应用本课真正练习的规则"
      ],
      "self_check": [
        "示例中哪个表达式创建了最终要输出的值？",
        "如果这个值为空、缺失或类型不对，会发生什么？",
        "起始代码中哪一行和Vec 和 HashMap规则直接相关？"
      ],
      "exercise_prompt": "完成Rust的Vec 和 HashMap练习。先预测起始代码当前会输出什么，再只修改和本课规则相关的部分。不要把期望输出直接写成常量。"
    },
    "rust-result": {
      "title": "Result 和 ?",
      "concept": "Result 表示可恢复错误，?。 在Rust中学习Result 和 ?时，先分清示例中哪一行创建值，哪个表达式读取它，哪一行把结果送到输出。修改起始代码前，先写下当前代码会输出什么。",
      "worked_example": "这个讲解示例用来定位Rust里Result 和 ?规则出现的位置。按顺序观察创建值的行、读取值的表达式，以及产生输出的语句。",
      "common_mistakes": [
        "只复制示例形状，却说不清Result 和 ?在代码中的作用",
        "没有确认Rust起始代码当前输出，就直接开始修改",
        "只改括号或标点，而没有应用本课真正练习的规则"
      ],
      "self_check": [
        "示例中哪个表达式创建了最终要输出的值？",
        "如果这个值为空、缺失或类型不对，会发生什么？",
        "起始代码中哪一行和Result 和 ?规则直接相关？"
      ],
      "exercise_prompt": "完成Rust的Result 和 ?练习。先预测起始代码当前会输出什么，再只修改和本课规则相关的部分。不要把期望输出直接写成常量。"
    },
    "rust-ownership": {
      "title": "所有权和借用",
      "concept": "值只有一个所有者，引用在不移动值的情况下借用它。 在Rust中学习所有权和借用时，先分清示例中哪一行创建值，哪个表达式读取它，哪一行把结果送到输出。修改起始代码前，先写下当前代码会输出什么。",
      "worked_example": "这个讲解示例用来定位Rust里所有权和借用规则出现的位置。按顺序观察创建值的行、读取值的表达式，以及产生输出的语句。",
      "common_mistakes": [
        "只复制示例形状，却说不清所有权和借用在代码中的作用",
        "没有确认Rust起始代码当前输出，就直接开始修改",
        "只改括号或标点，而没有应用本课真正练习的规则"
      ],
      "self_check": [
        "示例中哪个表达式创建了最终要输出的值？",
        "如果这个值为空、缺失或类型不对，会发生什么？",
        "起始代码中哪一行和所有权和借用规则直接相关？"
      ],
      "exercise_prompt": "完成Rust的所有权和借用练习。先预测起始代码当前会输出什么，再只修改和本课规则相关的部分。不要把期望输出直接写成常量。"
    },
    "rust-enum-match": {
      "title": "枚举和 match",
      "concept": "enum 建模多种可能，match 穷尽处理所有情况。 在Rust中学习枚举和 match时，先分清示例中哪一行创建值，哪个表达式读取它，哪一行把结果送到输出。修改起始代码前，先写下当前代码会输出什么。",
      "worked_example": "这个讲解示例用来定位Rust里枚举和 match规则出现的位置。按顺序观察创建值的行、读取值的表达式，以及产生输出的语句。",
      "common_mistakes": [
        "只复制示例形状，却说不清枚举和 match在代码中的作用",
        "没有确认Rust起始代码当前输出，就直接开始修改",
        "只改括号或标点，而没有应用本课真正练习的规则"
      ],
      "self_check": [
        "示例中哪个表达式创建了最终要输出的值？",
        "如果这个值为空、缺失或类型不对，会发生什么？",
        "起始代码中哪一行和枚举和 match规则直接相关？"
      ],
      "exercise_prompt": "完成Rust的枚举和 match练习。先预测起始代码当前会输出什么，再只修改和本课规则相关的部分。不要把期望输出直接写成常量。"
    },
    "rust-traits-lifetimes": {
      "title": "Trait、泛型和生命周期",
      "concept": "Trait 定义共享行为，生命周期描述借用关系。 在Rust中学习Trait、泛型和生命周期时，先分清示例中哪一行创建值，哪个表达式读取它，哪一行把结果送到输出。修改起始代码前，先写下当前代码会输出什么。",
      "worked_example": "这个讲解示例用来定位Rust里Trait、泛型和生命周期规则出现的位置。按顺序观察创建值的行、读取值的表达式，以及产生输出的语句。",
      "common_mistakes": [
        "只复制示例形状，却说不清Trait、泛型和生命周期在代码中的作用",
        "没有确认Rust起始代码当前输出，就直接开始修改",
        "只改括号或标点，而没有应用本课真正练习的规则"
      ],
      "self_check": [
        "示例中哪个表达式创建了最终要输出的值？",
        "如果这个值为空、缺失或类型不对，会发生什么？",
        "起始代码中哪一行和Trait、泛型和生命周期规则直接相关？"
      ],
      "exercise_prompt": "完成Rust的Trait、泛型和生命周期练习。先预测起始代码当前会输出什么，再只修改和本课规则相关的部分。不要把期望输出直接写成常量。"
    },
    "rust-iterators": {
      "title": "迭代器和闭包",
      "concept": "迭代器组合惰性转换。 在Rust中学习迭代器和闭包时，先分清示例中哪一行创建值，哪个表达式读取它，哪一行把结果送到输出。修改起始代码前，先写下当前代码会输出什么。",
      "worked_example": "这个讲解示例用来定位Rust里迭代器和闭包规则出现的位置。按顺序观察创建值的行、读取值的表达式，以及产生输出的语句。",
      "common_mistakes": [
        "只复制示例形状，却说不清迭代器和闭包在代码中的作用",
        "没有确认Rust起始代码当前输出，就直接开始修改",
        "只改括号或标点，而没有应用本课真正练习的规则"
      ],
      "self_check": [
        "示例中哪个表达式创建了最终要输出的值？",
        "如果这个值为空、缺失或类型不对，会发生什么？",
        "起始代码中哪一行和迭代器和闭包规则直接相关？"
      ],
      "exercise_prompt": "完成Rust的迭代器和闭包练习。先预测起始代码当前会输出什么，再只修改和本课规则相关的部分。不要把期望输出直接写成常量。"
    }
  }
}
